建案,地址,每坪房價(萬元),屋齡(年),主要車站通勤時間(分鐘),醫院距離(公里),學校距離(公里),半徑1km內公共及商業場域(個)
榕樹下,桃園市平鎮區復旦路二段150巷255弄2號,17.2,30,13,0.5953542072723588,0.1329333243415158,138.0
學府天下,桃園市平鎮區龍安路135號,14.4,29,18,3.0940774563112057,0.1752134058665612,33.0
龍門福星大樓,桃園市平鎮區新華路38巷10號,16.8,25,20,3.4901228775608755,0.1091533442995486,33.0
金色別莊,桃園市平鎮區文化街48巷20號,17.2,27,12,0.2780700781448876,0.1393074002889119,133.0
麗芝寶,桃園市平鎮區廣義街25巷28號,20.2,25,12,0.3248431485481102,0.1342936978122657,102.0
大觀園,桃園市平鎮區延平路二段430巷78號,17.8,29,10,0.1057678433190415,0.3178741001834279,135.0
金品,桃園市平鎮區崇義五街6巷10號,19.9,24,11,0.3007668260217712,0.1624695502641828,110.0
相知相許,桃園市平鎮區新富五街116號,15.2,29,10,1.058914854407253,0.6007985507925749,83.0
合邦富貴,桃園市平鎮區新德街250巷8號,9.7,29,9,0.6808876483330549,0.5796302326641751,137.0
城市家庭,桃園市平鎮區文化街263號,14.4,29,11,0.5055492732087158,0.2421817410431365,150.0
陽光大地二期,桃園市平鎮區新興路162號,14.5,28,9,0.3558583472292548,0.1306531160777124,175.0
金典,桃園市平鎮區延平路二段430巷28弄1號,14.3,26,10,0.1844228370153242,0.2496710129117278,131.0
龍大地,桃園市平鎮區龍南路656號,12.5,28,20,4.792055344176601,0.5364558822882404,24.0
東方名園,桃園市平鎮區華安街2號,11.5,23,20,4.165262792507461,0.4414741896677945,25.0
玫瑰園,桃園市平鎮區文化街284號,19.8,30,11,0.4536619961429167,0.2121643735839253,146.0
復旦上苑,桃園市平鎮區復旦路38號,21.1,5,8,0.2499489872695336,0.2070120128053688,167.0
文學園,桃園市平鎮區廣德街232號,20.9,22,11,0.5580490952296844,0.2290588642749675,159.0
宜誠禾雅,桃園市平鎮區自由街7巷45號,18.3,2,23,1.631817798036826,0.4034707851923064,16.0
春天2館,桃園市平鎮區莊隆街36號,17.7,8,18,2.926516625571357,0.7667806684457482,36.0
瑞旭首席,桃園市平鎮區中豐路南勢二段251巷6弄2號,16.2,8,15,3.875769063306409,0.1567486162740649,62.0
凱悅福星,桃園市平鎮區環南路35巷33號,16.2,26,9,0.1978847867995264,0.2067319929250578,165.0
瑞旭奕居,桃園市平鎮區平安南街20巷36號,18.4,6,9,0.2928538551914076,0.313282095459199,151.0
吉富隱舍,桃園市平鎮區漢口街65號,25.1,9,17,3.632629805893956,0.2941204521786231,60.0
長堤康橋,桃園市平鎮區復旦路二段117巷7弄11號,15.4,19,11,0.1813701488422927,0.1178867588369693,130.0
中壢新城,桃園市平鎮區南東路號,15.4,30,13,3.3883238839469807,1.1229143130969452,24.0
星友街42巷7號華廈,桃園市平鎮區星友街42巷7號,12.2,27,20,4.612669232785579,0.4966138956945591,24.0
雅居樂no.7,桃園市平鎮區金陵路三段150巷168號,15.1,3,14,2.923667377404524,1.1570240286252202,37.0
東京晴,桃園市平鎮區南京路12巷71號,17.9,9,14,3.1866827282030465,0.540962513386953,66.0
逸境,桃園市平鎮區三和路29號,15.7,6,16,3.632377901545301,0.9055039814929348,16.0
春虹大地B區,桃園市平鎮區興華街101巷16弄26號,17.2,23,13,0.5069736427724184,0.254583366506105,87.0
中正新,桃園市平鎮區中山路142號,13.2,28,17,2.372836280544841,0.4429323166434427,57.0
金賞二期,桃園市平鎮區延平路二段430巷47號,19.4,22,11,0.3503118133358875,0.1882594917572123,118.0
名人居,桃園市平鎮區復旦路二段117巷27弄6衖27號,19.0,18,11,0.1614742153358624,0.1656639252508063,127.0
育達路4巷6號華廈,桃園市平鎮區育達路4巷8號,20.4,5,8,0.2342323692955285,0.3147734707932595,179.0
東安貴族,桃園市平鎮區平東路239巷27弄19號,18.2,21,20,3.5471710526052616,0.1662816221521683,33.0
璞寓,桃園市平鎮區廣南路206號,26.1,11,12,0.8934594744470357,0.3550283313963737,66.0
生活特區,桃園市平鎮區忠孝路號,22.6,30,8,0.3592211729247662,0.3163767349064306,203.0
群都,桃園市平鎮區廣德街12號,26.5,15,10,0.1533252001402371,0.3280141130200606,154.0
龍南路188巷9號華廈,桃園市平鎮區龍南路188巷9號,12.7,29,16,2.674994246354771,0.2129165272388769,55.0
群都二期,桃園市平鎮區民族路二段193巷8號,20.6,13,11,0.1040884485664274,0.2735959698595813,139.0
振平街1號華廈,桃園市平鎮區振平街1號,12.5,32,8,0.6982886262117433,0.1373201279380727,114.0
平鎮新象,桃園市平鎮區上海路170號,15.4,29,16,3.633105887987115,0.4294139159776698,63.0
大清時尚,桃園市平鎮區迪化街11號,17.5,8,16,3.2340804187402368,0.7183401084497009,65.0
采邑華廈,桃園市平鎮區廣德街268號,11.8,21,10,0.4465581607542127,0.1505312667586151,161.0
金賞一期,桃園市平鎮區延平路二段430巷41號,15.0,22,11,0.3702214081281944,0.1686203224733734,116.0
雙璽,桃園市平鎮區崇義三街92號,17.6,15,11,0.2433024262521521,0.1130704098801833,116.0
環南家緣,桃園市平鎮區榮興街126號,11.8,28,9,0.8301356381675622,0.5719938832078827,108.0
禾寓,桃園市平鎮區南平路97號,20.1,7,14,3.075160120446136,0.6619651594290702,67.0
傳世經典,桃園市平鎮區振興路16號,20.3,21,8,0.6908054093117421,0.1129449100627414,114.0
金華,桃園市平鎮區延平路二段430巷易居二弄1號,18.5,25,10,0.2265189070477776,0.2316890409415861,130.0
寶中888,桃園市平鎮區復旦路二段117巷27弄5號,14.1,32,11,0.1224029300653301,0.1967515684487105,127.0
上原麗緻,桃園市平鎮區漢口街170巷11號,18.2,8,18,3.774730410464423,0.623200874379443,56.0
豪雅,桃園市平鎮區金華街138號,17.5,26,7,0.4401681000974544,0.3076521114445881,169.0
東光路1號華廈,桃園市平鎮區東光路1號,8.8,29,18,3.247695164253927,0.4052106289570718,29.0
禾鑫小築,桃園市平鎮區洪圳路134號,16.7,4,18,4.1616540010955605,0.706309651665408,22.0
安平街30號華廈,桃園市平鎮區安平街30號,17.5,31,8,0.4273152122894857,0.4282932050666002,144.0
尊品天下,桃園市平鎮區榮興街143巷1號,11.9,25,9,0.8534421570416285,0.5815445045980763,106.0
