建案,地址,每坪房價(萬元),屋齡(年),主要車站通勤時間(分鐘),醫院距離(公里),學校距離(公里),半徑1km內公共及商業場域(個)
銘傳大學市,桃園市龜山區明成街218號,23.6,15,13,1.290996557,0.647496193,36
林口藝術家大廈,桃園市龜山區文東五街47號,27.5,27,20,1.354413113,0.319921165,101
寶邑大廈,桃園市龜山區復興三路1號,28.8,21,26,1.053144306,0.476750656,246
香堤花園,桃園市龜山區萬壽路二段628巷9號,32.1,17,12,1.075820048,0.34981018,59
長榮鎮,桃園市龜山區南上路520巷28弄18號,12.4,29,22,1.095525142,0.802818368,27
智富館,桃園市龜山區文化七路181巷31弄28號,33.4,16,22,0.913158794,0.118236942,323
銘傳老闆,桃園市龜山區大同路238號,27.2,17,11,0.897034375,0.355377593,86
銘傳菁英會館,桃園市龜山區德明路21號,25.6,19,13,1.011640839,0.235653966,69
大景小城,桃園市龜山區優美街54巷10號,14.8,29,18,2.458440627,0.495757911,12
綠光,桃園市龜山區文化五路117號,31.6,27,22,0.495694957,0.312079984,296
青年才郡,桃園市龜山區文化二路34巷14弄11號,40.1,24,23,0.15592013,0.46921892,383
合康幸福漾,桃園市龜山區文康街107號,29.2,6,26,1.592281108,0.200104562,84
得意購,桃園市龜山區萬壽路一段425號,26.1,4,13,3.557220702,0.37497633,166
銘傳至尊,桃園市龜山區大同路261號地下一層,19.4,14,12,0.984498836,0.418663469,67
銘傳寶利發,桃園市龜山區明德路237號,16.1,19,11,0.656357508,0.245176944,119
大學之道五期,桃園市龜山區德明路89巷8號,29.7,17,12,0.899441882,0.241337996,83
九揚香璽,桃園市龜山區復興一路462號,24.3,14,21,1.196514647,0.192194396,145
聖陶沙,桃園市龜山區明興街223號,16.2,19,9,1.476520866,0.626160819,32
LA VIE 涵舍,桃園市龜山區復興二路10巷27弄8號,34.3,15,28,0.781941652,0.22333383,336
銘傳學府,桃園市龜山區明德路258號,21.1,20,11,0.684394284,0.228590639,114
八芳苑大樓,桃園市龜山區明興街114巷13弄6號,16.4,8,8,1.289834591,0.342224367,55
騰龍,桃園市龜山區東萬壽路34號,17.1,27,15,2.676892764,0.200550608,12
達鑫小松荷二期,桃園市龜山區文化三路81巷1號,41.9,14,23,0.124874899,0.352614724,376
香榭新都,桃園市龜山區興華五街45號,27.1,27,24,0.910110575,0.147280064,317
安敦翔鳳座,桃園市龜山區文三三街20巷1號,22.0,29,21,0.52354038,0.290301689,181
龍華天下,桃園市龜山區萬壽路一段312號,28.0,28,14,3.226275263,0.028527617,221
佳林寶鎮,桃園市龜山區復興二路11號,25.9,13,28,0.929321266,0.106957341,292
長庚麗晶,桃園市龜山區文二三街20號,33.3,26,23,0.183817286,0.358787177,370
興林雙喜五期,桃園市龜山區文化七路54巷10號,38.9,15,20,1.218945515,0.305663919,150
詠勝A8,桃園市龜山區復興南路17號,36.0,11,28,0.547943793,0.205089814,362
享豪,桃園市龜山區文化七路35號,29.2,18,21,1.089612488,0.318388241,216
九揚新凱悅,桃園市龜山區文二三街12號,43.3,22,23,0.217158582,0.354670506,375
捷運晶美,桃園市龜山區興華一街218號,29.5,11,22,0.320500056,0.479847982,350
櫻悅山莊,桃園市龜山區文化三路78巷30弄28號,27.4,17,23,0.267914258,0.14914837,350
立軒天玉,桃園市龜山區復興一路212巷25號,41.4,7,24,0.007273485,0.489369837,365
銘傳快得利尚品,桃園市龜山區德明路77巷67號,24.8,19,13,0.928434285,0.189510059,81
福樺Dior,桃園市龜山區文興路57號,38.7,17,23,0.204012637,0.440421347,377
八元及第,桃園市龜山區興華一街388號,20.9,10,23,0.409325334,0.286634462,358
昇捷M+,桃園市龜山區中興路168號之2,26.5,1,8,0.808898875,0.190271731,107
寶品極智,桃園市龜山區興華二街29號之1,37.4,1,22,0.386980358,0.442762365,301
長榮京華,桃園市龜山區南上路280巷11號,14.7,30,22,0.368459888,0.500139288,130
A8棧,桃園市龜山區復興二路131巷16號,29.9,4,27,0.81174561,0.235846589,310
九揚報喜二期,桃園市龜山區復興二路78巷66號,35.3,22,29,0.482801367,0.091617479,357
台北新天地,桃園市龜山區文化三路620巷80弄85號,23.6,27,30,1.493567212,0.487316432,68
亞昕花與樹,桃園市龜山區文化七路136號,32.1,17,21,1.050973345,0.026925844,286
享家,桃園市龜山區文二三街30號,36.5,19,23,0.167733664,0.377947016,371
瑞士花園BC區,桃園市龜山區文化一路10巷41弄5號,31.1,16,28,0.197050955,0.218944383,355
洵善大樓,桃園市龜山區文化二路28號之1,30.7,14,24,0.182608982,0.541926574,395
銘傳財庫,桃園市龜山區大同路104巷1號,17.4,18,11,0.460396016,0.151239662,122
秉和好運-品悅區,桃園市龜山區大湖一路138巷122號,25.4,1,20,1.515108969,0.281301974,48
貿商新城B區,桃園市龜山區中興路171巷13號,15.4,22,8,0.867805983,0.148332474,113
捷運特利屋三期,桃園市龜山區文昌五街80號,30.7,13,28,0.443425838,0.080637111,358
佳鄰文化,桃園市龜山區文化七路188號,25.1,21,21,1.026000471,0.129053024,286
華亞麗晶,桃園市龜山區文化二路48號,39.8,16,24,0.26432732,0.553528034,365
臻愛家,桃園市龜山區建國東路79號,22.0,15,4,0.566802453,0.651862898,118
錢龍皇,桃園市龜山區大同路174號,24.8,26,11,0.72509184,0.376220267,116
大學之道二期,桃園市龜山區德明路130號,24.4,19,12,0.972129156,0.234640619,77
春虹大郡,桃園市龜山區明興街221巷30弄21號,21.7,20,10,1.460705942,0.650540904,36
太子地球村B區,桃園市龜山區萬壽路二段653巷3號,22.3,15,11,0.914631613,0.145233924,82
雅緻小築,桃園市龜山區文三三街38巷6號,27.8,18,22,0.524155991,0.228362294,181
和煦隆陞,桃園市龜山區文青路198號,31.7,1,21,2.413418093,0.590834821,83
林口高典,桃園市龜山區文化三路52號,31.7,25,22,0.236221672,0.284596597,364
公園A8,桃園市龜山區復興南路77號,33.1,2,27,1.005176645,0.355898923,266
寓居,桃園市龜山區楓樹三街96號,25.2,5,12,1.437978726,0.457711561,50
金元寶,桃園市龜山區龍華街22號,18.7,25,13,3.182817711,0.076406023,221
青年才郡二期,桃園市龜山區文二三街27號,41.6,24,23,0.172634975,0.394585256,373
昇樺喜閱,桃園市龜山區自由街8巷,28.3,3,13,0.421408079,0.092111506,231
御園道,桃園市龜山區文三二街66巷5號,26.6,17,22,0.410375363,0.069664535,295
林口雅築二期,桃園市龜山區文昌一街3號,29.2,29,24,0.343654212,0.465859828,365
銘傳E族,桃園市龜山區明德路270號,16.7,21,11,0.730443894,0.220341957,111
皇家勳章,桃園市龜山區復興一路330號,31.3,17,23,0.234003304,0.36275878,347
連翔初韻,桃園市龜山區復興二路99號,33.9,1,27,0.756174212,0.177961581,338
美麗國,桃園市龜山區大同路313巷10號,15.6,26,13,1.133012068,0.556955783,47
正鉅龍脉,桃園市龜山區明德路158號,19.8,9,10,0.442261228,0.16251555,130
龍鳳禾園大樓,桃園市龜山區龍鳳街28號,28.3,11,12,0.301140612,0.062181903,250
頂好名樓大廈,桃園市龜山區萬壽路一段頂好巷2號,22.6,21,15,3.330986652,0.134103702,209
佳林,桃園市龜山區復興二路9巷7弄36號,29.2,17,27,0.98360999,0.10619467,284
大內高手,桃園市龜山區文化三路315號,34.6,23,22,0.182058402,0.548129972,362
捷運特利屋二期,桃園市龜山區文昌五街108號,37.5,15,27,0.424498847,0.038761789,357
龍廷,桃園市龜山區振興路46號,21.7,29,13,1.547836595,0.803698,41
知青,桃園市龜山區文七二街5號,29.6,10,22,0.485508654,0.382546033,266
金朋名人天下,桃園市龜山區中和南路94巷1號,16.9,25,9,0.061368431,0.115346794,134
龍鳳學院大廈,桃園市龜山區龍新街60號,32.5,13,12,0.29921821,0.075736374,253
校園吉第,桃園市龜山區萬壽路一段241巷3弄15號,28.4,26,12,0.403654303,0.095063771,251
宜誠晶華,桃園市龜山區南祥路87巷12號,21.5,21,22,0.239206543,0.251046986,156
知築藏樂藏樂區,桃園市龜山區興華三街28巷26號,29.1,7,22,0.330148621,0.440309531,359
飛行館,桃園市龜山區文化七路181巷30號之,31.4,16,22,0.928436262,0.126189175,312
連翔出雲大廈,桃園市龜山區復興二路10巷37弄22號,32.6,15,29,0.564963093,0.249719125,366
尊龍座,桃園市龜山區文昌三街100號,22.5,29,29,0.423942716,0.291658641,361
SANTORINI,桃園市龜山區明德路350號,9.0,20,12,0.992762144,0.299798914,69
瑞士花園G區,桃園市龜山區復興北路52號,36.4,17,28,0.222630785,0.255012797,353
天成園,桃園市龜山區自強南路694號,16.7,31,8,0.582762967,0.417968573,112
佳林帝寶皇家,桃園市龜山區忠義路二段638巷36號,28.1,16,21,0.546471946,0.174588326,169
捷運特利屋一期,桃園市龜山區文昌一街15巷6號,33.3,16,30,0.322303164,0.412499104,361
新京典,桃園市龜山區文三二街52巷27號,27.4,12,21,0.429903811,0.144297731,257
宜誠森鄰御,桃園市龜山區光榮路77號,21.9,13,12,1.554658945,0.332636129,28
捷荷,桃園市龜山區文昌二街21巷5號,36.0,9,29,0.524421994,0.360622352,362
五福雅居,桃園市龜山區南祥路95號,19.1,24,22,0.282131128,0.2679429,153
佳寶公寓,桃園市龜山區文化七路183號,31.5,20,21,1.013195926,0.126210233,294
久鈺富寓,桃園市龜山區文七五街96號,31.8,7,22,0.429093394,0.429226917,282
和平山莊,桃園市龜山區文昌五街15號,29.8,20,28,0.586500613,0.351819587,363
國產花園新城,桃園市龜山區中和路6號,14.7,36,9,0.284899958,0.10234967,130
證源富陽,桃園市龜山區文明路125號,19.1,15,25,1.576668248,0.21640809,91
微風,桃園市龜山區明德路明駝巷8號,15.2,25,11,0.430055527,0.155844728,129
台北華府,桃園市龜山區文二三街65號,34.1,24,23,0.068301694,0.433360216,378
明興,桃園市龜山區明興街143巷1號,14.4,26,9,1.295292368,0.386461765,50
太子地球村E區,桃園市龜山區萬壽路二段601巷8號,19.2,15,11,1.01875772,0.227005718,64
尊爵賞,桃園市龜山區忠義路二段489巷31號,18.1,16,19,1.465350049,0.087122227,79
雙享樓,桃園市龜山區萬壽路二段1219號,22.9,27,10,0.846308238,0.245167452,142
新宿,桃園市龜山區文東五街107巷11號,25.1,17,20,1.224145439,0.113294232,161
林口NBA,桃園市龜山區文二三街21號,25.0,27,23,0.187654559,0.392949018,373
名人華廈,桃園市龜山區文化一路78號,23.5,23,27,0.98039955,0.407999668,268
寶品雙馨,桃園市龜山區興華五街73號,31.5,11,21,0.991784372,0.071295574,302
御品苑,桃園市龜山區自強東路150巷6號,22.0,12,10,0.506888417,0.210501219,113
溫哥華特區,桃園市龜山區文化七路26號,21.1,16,21,1.137445216,0.307537896,189
台北奇蹟,桃園市龜山區文德二路138巷11號,17.2,29,27,1.506372907,0.438349367,78
吉安,桃園市龜山區文七五街9號,23.6,15,22,1.09158408,0.353526689,224
文化家園,桃園市龜山區文化七路54巷13號,26.0,15,20,1.217080751,0.279564852,151
大學之旅,桃園市龜山區大同路112號,25.6,16,11,0.478254044,0.160688364,123
書香畫堤,桃園市龜山區復興二路75巷11號,30.9,17,28,0.855969045,0.285634097,296
長峰金三角,桃園市龜山區長峰路156號,19.2,11,10,1.103574331,0.188360887,58
林口雅築一期,桃園市龜山區文昌一街47巷7號,23.0,29,28,0.237255704,0.299515879,354
吉祥企業大樓,桃園市龜山區萬壽路二段412號,12.8,26,12,1.634699766,0.846890495,35
富寓家園,桃園市龜山區文光街2號,18.9,8,26,1.415224943,0.386659132,95
嚮陽,桃園市龜山區文東五街57巷58號,24.9,11,21,1.209667691,0.34058765,157
祈德大廈,桃園市龜山區復興二路127號,37.5,26,27,0.566420368,0.17227228,339
友緣軒,桃園市龜山區文三二街39號,16.4,17,22,0.353923674,0.055222408,337
東豪光峰華廈,桃園市龜山區光峰路260巷37號,29.9,9,11,1.170007297,0.164735443,54
銘傳快得利小品,桃園市龜山區明德路292號之1,18.4,19,11,0.770897836,0.241148298,108
川弘雅築三期,桃園市龜山區復興南路106巷37號,24.5,19,27,0.983130466,0.405192713,267
九揚英格蘭五期,桃園市龜山區興華三街10號,20.4,31,23,0.431752908,0.269340695,361
文二三街16號華廈,桃園市龜山區文二三街16號,41.0,27,23,0.200945839,0.361505925,372
錢隆皇,桃園市龜山區大同路172巷2弄1號,14.9,26,11,0.710501195,0.387808451,115
公園校墅,桃園市龜山區文東五街126巷10號,22.2,16,20,1.269477943,0.117190706,138
文化,桃園市龜山區文化五路92號,30.1,18,21,1.007456973,0.281795701,289
人文領域大廈,桃園市龜山區復興南路26巷23號,29.0,18,28,0.501553813,0.120362563,356
貴族名邸,桃園市龜山區文東五街37巷40號,29.7,32,21,1.303708437,0.351384861,118
文化林築,桃園市龜山區大湖一路159號,25.4,14,19,1.4166608,0.106101964,85
知築藏樂知築區,桃園市龜山區文東五街85號,30.0,8,20,1.297919647,0.190372598,119
九揚報喜一期,桃園市龜山區文昌五街78號,34.7,22,28,0.453019553,0.098939465,360
大湖寶鎮,桃園市龜山區大湖一路27號,30.5,18,21,0.554510072,0.227469957,165
寶帝,桃園市龜山區興華五街28號,33.8,16,22,0.879889695,0.182459751,319
富中綠大地一期,桃園市龜山區文善街84號,19.3,29,28,1.497554928,0.565847109,70
復興佳洋華廈,桃園市龜山區復興二路131巷72號,24.3,19,26,0.962294046,0.385735663,271
馨和園,桃園市龜山區文化東路69號,21.0,24,21,1.255709635,0.235027478,141
九揚英格蘭六期,桃園市龜山區文化三路78巷13號,18.7,31,22,0.146161601,0.263389409,367
緣圓園一期,桃園市龜山區興華一街242號,21.9,18,22,0.30673104,0.411112524,345
綠邑,桃園市龜山區文七五街20號,30.2,10,22,1.237439907,0.213677966,144
川弘雅築二期,桃園市龜山區文七二街78號,31.8,20,21,1.264853623,0.166568297,141
喜臨門,桃園市龜山區復興二路75巷20弄20號,20.8,24,27,0.884379313,0.306082252,284
客鄰華廈,桃園市龜山區中興路90巷61號,12.9,29,8,1.154089459,0.182896937,77
富寓二期,桃園市龜山區文光街6號,21.5,8,26,1.431227966,0.378228742,95
緣圓園二期,桃園市龜山區文化五路15號,24.7,18,21,0.343397416,0.427297067,325
公園大道,桃園市龜山區復興二路33巷30號,27.4,28,28,0.946221578,0.262402775,282
復興佳林公寓,桃園市龜山區復興二路83號,23.9,21,27,0.764833607,0.191168875,333
瑞士琉森,桃園市龜山區文化七路48號,23.1,17,21,1.178683045,0.319979633,177
和歌山,桃園市龜山區文東五街117巷35號,29.8,5,21,1.263730125,0.281559964,133
維也納壹期,桃園市龜山區文七一街55號,17.6,32,21,1.199195939,0.180533847,148
文化三路79號華廈,桃園市龜山區文化三路79號,22.1,28,23,0.128766316,0.360674609,376
捷運御景,桃園市龜山區萬壽路一段542號,23.2,11,15,3.304194606,0.684842676,110
嘉峰誠品華廈,桃園市龜山區文化七路182巷60弄15號,25.8,16,27,1.284225422,0.373371028,116
福德,桃園市龜山區文化五路107號,27.2,16,22,0.438745135,0.378003416,300
佳合,桃園市龜山區文化七路142號,38.2,19,21,1.050844798,0.034387271,289
享豪華廈,桃園市龜山區文化七路182巷73號,26.0,13,28,1.290806643,0.361841434,113
曼哈頓特區,桃園市龜山區文化五路23號,24.6,16,21,0.364580563,0.45328786,299
環球企業大樓,桃園市龜山區萬壽路二段343號,8.5,29,16,1.984917803,0.82749356,14
銘傳學苑,桃園市龜山區明德路240巷12號,23.2,21,11,0.645783657,0.22063126,117
文華君堡二期,桃園市龜山區文七一街45號,24.9,16,21,1.152940282,0.226397955,160
寶邑二期,桃園市龜山區興華五街52號,27.9,19,21,0.950992233,0.132995059,310
瑞安,桃園市龜山區文化七路206巷10號,23.4,12,28,1.04763002,0.190130012,285
峰暉金典,桃園市龜山區文化五路10號,27.4,21,21,0.345090961,0.392169679,320
經典,桃園市龜山區文化七路206巷70弄11號,25.8,17,28,1.180802932,0.300188362,219
雙馨二期,桃園市龜山區文化七路181巷25號,24.3,10,22,0.949905732,0.107532175,306
凱富香賓,桃園市龜山區文七三街11號,27.9,16,22,1.067924251,0.359230856,236
雅典皇家,桃園市龜山區文化三路78巷3號,24.5,17,23,0.118301177,0.296381164,371
NEW麗晶,桃園市龜山區文東五街13號,27.2,16,21,1.355899471,0.301168023,99
堊凰文東一街華廈,桃園市龜山區文東一街2號之2,38.9,7,22,1.069717794,0.261324325,268
