歡喜樓三期,新北市林口區忠孝路376巷41號,41.3,27,30,1.0628514269465488,0.2161819742706108,364.0
京澄謙隱,新北市林口區文明街183號,24.8,11,28,1.4678433889028504,0.3971414793204834,235.0
世界市-環球館,新北市林口區文化北路二段550巷20弄39號,33.0,4,37,3.5342188486072827,1.171454081048665,24.0
SMART家族,新北市林口區麗園二街10號,37.9,39,30,1.380062416739289,0.2192846390068892,146.0
大觀園二期,新北市林口區文化三路一段29號,38.8,13,24,0.9337128320313534,0.4000873089336507,294.0
信義國堡,新北市林口區文化二路二段105號,27.1,15,33,2.422031818740728,0.5155989759746766,246.0
光之御所日光區,新北市林口區文化三路一段39巷100號,28.7,13,26,1.0881069882714856,0.3029420257037094,252.0
承冠禮讚,新北市林口區文化三路一段394巷37號,36.0,11,30,1.1623776502467862,0.3265681147231103,351.0
源峰寬庭,新北市林口區文林四街35號,32.6,10,36,2.746796894167497,0.3649850954686081,105.0
文化麗園,新北市林口區忠孝路625號,23.7,14,30,1.4762982072900983,0.3438277247019845,113.0
德馨居,新北市林口區民族路276號,25.2,14,33,1.9651451157912767,0.1803659772611167,237.0
涵碧館,新北市林口區興林路151巷2號,23.5,15,33,2.542237937258633,0.0913295399430074,286.0
有朋之里,新北市林口區文化三路二段115巷46號,34.3,14,35,2.333187716249182,0.0851693219827427,160.0
德馨居三期,新北市林口區文化三路一段39巷181號,44.1,11,25,1.150455203392141,0.2151636795383736,243.0
采鑽,新北市林口區民族路96號,22.6,13,29,1.608048293739855,0.6956110690240768,295.0
天地之美,新北市林口區文化二路一段260巷1號,28.0,22,31,1.369157110332286,0.5224270222548257,316.0
嘉年華,新北市林口區文化二路一段230巷22弄1號,36.4,27,31,1.2239311438966802,0.3849562419700273,313.0
珍隱,新北市林口區民權路82號,26.4,14,34,2.3528969283077608,0.0357415504912037,151.0
文化新象,新北市林口區文化二路一段90號,32.8,16,29,0.9436462929870528,0.1858886760816074,320.0
大極文化苑,新北市林口區文化一路一段89號,34.1,7,28,1.0851484356601222,0.2510983625036288,349.0
富堡晶城,新北市林口區公園路56號,33.6,11,29,0.9953765265052068,0.1619296991086988,363.0
麗江閱大樓,新北市林口區文化三路二段115巷135號,30.8,11,34,2.3212887551245465,0.1812051687234674,164.0
圓舞曲,新北市林口區文化北路一段299巷16號,30.6,8,27,1.601449571140927,0.228119959077798,202.0
草葉集二輯,新北市林口區公園路151號,28.5,16,31,1.1909449075840886,0.3519508459677543,318.0
綠邑,新北市林口區南勢六街35巷27號,26.5,9,26,1.6228973736029886,0.3182801022292666,142.0
力璞天馳,新北市林口區公園路1號,28.7,13,25,0.5866592839063268,0.3596259032108052,478.0
人文觀點,新北市林口區民權路22號,23.3,16,34,2.166177764957306,0.1258509447595105,172.0
豐田歐園,新北市林口區麗園一街13號,30.8,22,30,1.3109106011928335,0.1428675905490957,163.0
領袖花園,新北市林口區公園路180號,31.5,12,30,1.3812525289911175,0.5353290741456993,310.0
青荷二期,新北市林口區文化二路一段230巷70號,26.4,16,32,1.3781726838973714,0.5326495134576047,316.0
仁愛富軒,新北市林口區仁愛路二段269號,34.5,14,32,1.8933116579213405,0.246096684474141,243.0
青荷,新北市林口區公園路179號,28.3,17,30,1.268185322243222,0.4217404495869942,313.0
真藏館,新北市林口區文化三路一段450號,35.1,13,33,1.5195908433720886,0.5742754309726513,316.0
大觀園,新北市林口區文化三路一段435號,36.1,14,31,1.4885596744081544,0.6431830245595468,316.0
草葉集一輯,新北市林口區文化二路一段214號,27.8,16,32,1.229186222977255,0.3898831521053786,316.0
金美滿二期,新北市林口區文化二路一段20巷48號,37.8,27,27,0.6568260388792068,0.399650071306465,475.0
金星銀河,新北市林口區仁愛路二段309號,27.0,15,33,1.9535924590222875,0.0936068939395865,229.0
川弘五期,新北市林口區中山路299號,24.9,17,33,2.656027966859728,0.0438004314835167,331.0
海德新都,新北市林口區四維路114號,23.8,19,32,2.109517092321091,0.20369549473919,260.0
法國小鎮香堤E區,新北市林口區育林街11巷2號,28.2,15,34,2.42109070774395,0.4147550629471725,308.0
哥德花園,新北市林口區文化二路一段260巷10號,30.4,21,32,1.344584384532157,0.4998768783862694,316.0
