建案,地址,每坪房價(萬元),屋齡(年),主要車站通勤時間(分鐘),醫院距離(公里),學校距離(公里),半徑1km內公共及商業場域(個)
小富翁,桃園市楊梅區富民街143巷250弄180號,10.3,18,34,3.296642972495412,2.06448884645702,0.0
龍大莊,桃園市楊梅區民族路五段201巷75弄1號,14.6,22,19,3.136403881358642,0.5715778008256088,38.0
愛上湖,桃園市楊梅區上湖一路388號,12.6,5,30,5.649938658382072,1.7141767924717362,1.0
唐莊．亞太新市鎮,桃園市楊梅區新榮路167巷1號,11.2,25,21,4.394432533506666,1.380161820791409,36.0
三秀雅硯,桃園市楊梅區瑞溪路一段176巷2號,15.6,19,18,0.8869918769696058,0.2071702801019295,70.0
快樂小鎮,桃園市楊梅區快速路五段897號,15.2,15,18,3.745206771023673,1.545388718724373,12.0
湖庭逸墅,桃園市楊梅區員本路49號之13,15.5,12,29,4.060307743754354,1.3604327726132928,24.0
印象歐洲,桃園市楊梅區裕榮路323巷2號,16.3,21,21,4.270966763159178,1.28022455155834,39.0
百豐享生活,桃園市楊梅區高獅路365巷88號,20.7,2,19,1.375090250496677,0.9376890786032668,7.0
