愛家親子名廈,台北市萬華區中華路二段662號,58.3,33,13,0.1312590617358265,0.0784380178586646,617.0
珍珠大樓,台北市萬華區西寧南路11號,55.2,40,5,0.3698145213644864,0.2568970889555678,1912.0
萬代年華大廈,台北市萬華區桂林路127巷11號,48.0,28,10,0.3242478837330564,0.2892213865549534,1276.0
桂林天下,台北市萬華區西園路一段120號,53.0,25,10,0.2135796069822963,0.2729811785030611,1186.0
金帝大廈,台北市萬華區康定路206號,41.3,44,9,0.3931595801100884,0.1646597362219848,1376.0
潤泰翡翠,台北市萬華區中華路一段170號,82.9,17,7,0.407523114713877,0.3425003276791834,1976.0
大和庄,台北市萬華區萬大路628號,45.6,13,12,1.6228756925210557,0.6450441075030748,215.0
景深,台北市萬華區東園街67巷19號,62.2,9,13,0.3324585709868063,0.0658848911575296,782.0
榮耀御寶,台北市萬華區西寧南路241號,59.0,18,8,0.326774962523175,0.3537588027712277,1818.0
宏珍大樓,台北市萬華區康定路97號,41.7,37,9,0.2750636095547482,0.2509177799230994,1438.0
榮耀鴻禧,台北市萬華區貴陽街二段79號,50.4,19,8,0.2216989526706088,0.3005344942109369,1618.0
康莊大廈,台北市萬華區康定路43號,41.9,28,9,0.0840499288180124,0.2110619262091225,1471.0
東園名邸,台北市萬華區東園街99號,54.3,11,13,0.345354279934101,0.2080689390100634,625.0
泰興大廈,台北市萬華區桂林路32號,40.3,39,8,0.3131287985632336,0.1901868765014503,1647.0
龍府大廈,台北市萬華區西園路一段136巷1號,41.7,34,10,0.1766921878832134,0.2581151386180075,1114.0
富第大樓,台北市萬華區柳州街6號,32.1,31,8,0.3348725381913159,0.3399729731143697,1762.0
國賓時代大廈,台北市萬華區內江街63號,63.3,19,8,0.1261986094047844,0.1316060293414392,1696.0
16馥,台北市萬華區長沙街二段173號,46.0,11,9,0.1806548259373419,0.3166465121546209,1403.0
品陽麗芙花園,台北市萬華區莒光路299巷17號,53.5,12,11,0.763782836787938,0.1262973569816343,1022.0
榮耀富麗,台北市萬華區柳州街2號,61.8,15,8,0.3278737195188935,0.3493487088019775,1769.0
總督賞大廈,台北市萬華區長沙街二段92號,66.0,21,7,0.2038282671455204,0.2592478820945102,1728.0
青年大樓,台北市萬華區富民路145巷34弄3號,36.2,39,16,1.0732628710170298,0.2669153275526263,328.0
臺北市忠貞國民住宅,台北市萬華區青年路138號,62.7,26,14,0.7713373888312517,0.2123191259844873,559.0
早安老松,台北市萬華區昆明街243號,55.5,23,9,0.3938353609055249,0.1667727680669673,1572.0
華園大樓,台北市萬華區西園路二段127號,43.6,24,11,0.3015364675545233,0.2152746022660225,832.0
力福商業大樓,台北市萬華區西寧南路30號,51.6,32,6,0.2664685687715429,0.2382356604392511,1820.0
喜福匯大廈,台北市萬華區西昌街107號,60.0,20,8,0.2376996750911608,0.3831619421569289,1330.0
桂林松園大廈,台北市萬華區桂林路77號,46.7,19,9,0.3992125085145234,0.1225142400740444,1431.0
富邑,台北市萬華區長沙街二段88號,61.3,17,7,0.2082305098295466,0.2605759895184393,1735.0
泰興御品苑,台北市萬華區長泰街148號,56.1,11,15,1.2593280251768997,0.1011322388831096,470.0
總督天廈,台北市萬華區長沙街二段149巷2號,52.0,32,8,0.1533288726859724,0.2468291841933275,1491.0
中富大廈,台北市萬華區和平西路二段147號,43.6,43,8,0.2593562799159776,0.2083458956180647,1160.0
亞太財星大廈,台北市萬華區中華路一段68號,68.9,24,10,0.4642762423605077,0.098157510258963,2226.0
賓士名宮,台北市萬華區南寧路31號,41.3,31,9,0.2519381747074682,0.0879468638824039,1540.0
中央登峰,台北市萬華區忠孝西路二段38號,76.9,15,5,0.3485272522855444,0.2003993048461748,2109.0
昇陽鵬馳大廈,台北市萬華區西寧南路12號,76.0,20,6,0.3624037001401766,0.1904908941956148,1924.0
西園新故鄉,台北市萬華區西園路二段281巷28號,39.0,22,11,0.4565821742706021,0.3907670152228797,389.0
福華大樓,台北市萬華區西園路一段168號,46.0,34,10,0.1205387654414109,0.3268064957909881,1059.0
金西門大廈,台北市萬華區開封街二段77號,48.3,42,6,0.3173012244793239,0.4131221364075282,1423.0
麒麟京華大樓,台北市萬華區康定路154號,41.4,23,9,0.2805594190262629,0.2626779130130576,1417.0
皇家將相,台北市萬華區昆明街192號,47.8,22,9,0.106804088823462,0.1589753659029003,1685.0
昆明家園大廈,台北市萬華區昆明街142號,59.1,40,8,0.1383911478366159,0.0674235540429032,1641.0
德林大禮,台北市萬華區大理街147號,57.5,18,12,0.3074094981564859,0.1713324637478005,828.0
龍之最大樓,台北市萬華區廣州街265巷1號,41.5,21,10,0.1670969851417637,0.158343414914188,676.0
福星大第,台北市萬華區開封街二段40號,37.9,21,6,0.3691853234294256,0.1326153771482444,2058.0
天益松柏,台北市萬華區三水街22巷2號,48.4,34,9,0.2947526259499057,0.1244909260014263,1285.0
德金大樓,台北市萬華區漢中街147巷5號,51.7,39,7,0.3679863444996651,0.35882713398813,1900.0
好景龍第,台北市萬華區環河南路一段181號,40.3,25,8,0.402553814723354,0.2427225663934162,1049.0
綠地園,台北市萬華區西園路二段303號,40.0,28,10,0.4872610887168542,0.3603920175165184,404.0
西門河畔,台北市萬華區環河南路一段59號,40.3,27,6,0.2641965632955791,0.2679905748139689,1196.0
麒麟大樓,台北市萬華區康定路114號,43.7,40,9,0.1319742141541388,0.2620540000255559,1449.0
新內閣大廈,台北市萬華區長沙街二段51號,58.1,20,7,0.2396872215544449,0.2580687420743227,1801.0
香波堡,台北市內湖區瑞光路126號之6,76.0,15,11,1.2501608274077225,0.7515200354424029,495.0
湖山村,台北市內湖區康寧路三段75巷186弄10號,42.7,37,12,0.4673761053571673,0.3564579024053386,414.0
歐香別墅,台北市內湖區民權東路六段423巷9弄37號,68.0,24,12,0.5813427287422764,0.0793104530980168,320.0
湖綠歐清泉,台北市內湖區民權東路六段248巷26號,62.0,21,11,1.0770986379845269,0.7093377743193425,193.0
墅琴,台北市內湖區民權東路六段191巷62弄10號,60.0,16,11,0.5976585278869546,0.3321494123620964,163.0
康橋別墅,台北市內湖區瑞光路112巷58弄1號,63.3,24,12,1.2579318932193506,0.6775122814149842,437.0
嘉新尊皇,台北市內湖區瑞光路120巷1號,65.8,21,11,1.2018737369595898,0.6854902018150877,473.0
麗景山莊,台北市內湖區金湖路363巷67弄25號,55.8,24,12,0.7746731469963346,0.1217215987460538,272.0
童顏別墅,台北市內湖區瑞光路122巷112號,62.5,17,12,1.3260844034632269,0.7640966930373007,459.0
極光別墅,台北市內湖區民權東路六段180巷55弄1號,59.1,21,9,0.5093025394487438,0.4722981574221625,156.0
城隱,台北市內湖區民權東路六段123巷21弄13號,55.3,17,10,0.2153409141843243,0.3345964717406268,168.0
溫莎別墅,台北市內湖區民權東路六段123巷43弄10號,65.1,24,11,0.1488892234144245,0.2555473114784216,199.0
長虹四季,台北市內湖區民權東路六段191巷143號,55.5,19,11,0.6990148778126782,0.3956759850968185,191.0
湖濱,台北市內湖區大湖街131巷37號,41.9,34,17,1.1097482085515848,0.1635752928642071,402.0
上善若水,台北市內湖區金湖路401巷37號,62.3,16,13,0.6356023814895038,0.1087227397965858,310.0
御湖,台北市內湖區麗山街99號,61.9,20,15,1.6762812943862777,0.0815707498917507,650.0
春之森青松Ａ區,台北市內湖區民權東路六段190巷21弄10號,58.5,24,9,0.4599296324723751,0.3928973370604163,131.0
大杰一院香,台北市內湖區民權東路六段245巷50號,62.2,14,11,0.9023381891043276,0.5768276719416443,198.0
麗湖園,台北市內湖區金湖路363巷25弄10號,59.0,24,12,0.8093710160584955,0.0594257957764678,260.0
城心美學,台北市中山區雙城街49巷18號,65.3,8,12,0.3653848426134075,0.2033322193825999,883.0
菁典館,台北市中山區敬業一路128巷47號,87.7,14,16,0.5242433048359757,0.6789351053696814,445.0
中山麗緻,台北市中山區林森北路557巷3號,80.0,12,12,0.0429873438818806,0.0914715596347438,1368.0
松江桂冠,台北市中山區松江路226巷1號,88.4,10,12,0.3250511643004704,0.38811322379857,1908.0
亞都頂客大廈,台北市中山區吉林路411號,48.4,26,12,0.5486286891910075,0.5115475786071839,909.0
蘭庭華廈,台北市中山區北安路458巷47弄10號,77.3,40,15,2.553557631963536,0.2062778131991748,307.0
晶華2000,台北市中山區林森北路107巷81號,59.9,39,8,1.0765509517225365,0.2437365064741298,2433.0
翡冷翠花園大廈,台北市中山區民生東路二段77號,57.3,43,9,0.3863094029073068,0.3864128691301582,2111.0
春邸華廈,台北市中山區新生北路二段62巷40號,48.9,25,9,0.8293391435345782,0.4120009701068523,2427.0
明皇大廈,台北市中山區中山北路二段93巷21號,57.6,43,9,0.2617303012087329,0.3249066014502994,2066.0
福壽大樓,台北市中山區林森北路107巷30號,52.5,40,11,1.114822439656957,0.3545561236053853,2650.0
大華儷園大廈,台北市中山區復興北路488巷1弄1號,58.5,39,16,1.0067662170789675,0.2051028636090585,513.0
正章大廈,台北市中山區林森北路353巷20號,75.3,45,10,0.4368370242411023,0.421473507067967,2439.0
力行新城信義,台北市中山區通北街118巷1號,60.4,23,16,1.861852312136712,0.786963622041376,159.0
德惠大青大樓,台北市中山區德惠街37號,60.3,43,11,0.2603836090639739,0.3105430455759747,1003.0
新添成大廈,台北市中山區新生北路三段57號,59.6,46,11,0.2665491930838865,0.0959506150128128,1105.0
如意大樓(吉林路),台北市中山區吉林路365號,65.1,43,12,0.4004355977160365,0.4311896759109615,1076.0
梅園,台北市中山區長安東路一段53巷16號,53.6,35,7,1.0946295610739796,0.3280131677827972,2602.0
六本木一番館,台北市中山區中山北路一段121巷27號,53.7,16,7,1.1794948879825065,0.4547997836292348,2461.0
三陽蘭園,台北市中山區合江街180巷1號,77.8,45,14,0.7624888720402452,0.4383485863692634,1430.0
明昌精典大廈,台北市中山區錦州街23巷12號,74.1,7,9,0.2854832662131425,0.1793727575824931,1760.0
松江JR,台北市中山區松江路330巷53號,91.4,15,12,0.0506137919372828,0.489153097804562,1631.0
寶格麗,台北市中山區中山北路一段121巷19號,77.8,12,7,1.169990103252963,0.4873827243195903,2398.0
時尚麗舍華廈,台北市中山區南京東路二段24巷8號,105.2,18,9,0.9366638852103796,0.030093783051471,2398.0
勤樸臻藏,台北市中山區新生北路三段85號,66.9,3,10,0.3775605335339463,0.4370659884816789,901.0
松江金棧,台北市中山區松江路562號,52.7,26,14,0.7232857477685286,0.6857848770498695,730.0
巴黎花園,台北市中山區基湖路151巷36號,74.8,13,13,0.8262758630164411,0.3478480895729557,440.0
芳鄰大廈,台北市中山區新生北路三段82巷1號,62.4,36,12,0.3168276060269064,0.3619224405112341,957.0
中山碩尚,台北市中山區雙城街12巷16號,70.4,25,12,0.1926748501210856,0.2661197003409273,1327.0
松江新貴,台北市中山區民權東路二段135巷32號,75.9,8,11,0.4673439602746219,0.7173679184015951,890.0
英格蘭世家AB棟,台北市中山區明水路557巷10號,89.7,31,16,0.6384740889876839,0.1055144651629445,407.0
官景大廈,台北市中山區民族東路170號,69.0,9,11,0.6754034744358111,0.6012736129668594,756.0
東京行館,台北市中山區松江路69巷11號,102.4,9,11,0.4932507250903554,0.3259595583946175,2149.0
美麗華BR1,台北市中山區北安路805巷4弄6號,91.9,5,16,0.7591689622990027,0.551842655156998,380.0
花見,台北市中山區長安東路一段40號,83.7,2,6,0.9706362920708488,0.3607485589612498,2392.0
伊通馨苑,台北市中山區建國北路一段50巷25號,92.2,5,10,0.5539988091152029,0.2381542077376192,2202.0
摩登達人,台北市中山區遼寧街62巷20號,72.2,14,14,0.4152247830475012,0.0422391393764058,2249.0
臺北市圓山新城,台北市中山區通北街65巷2弄10號,54.6,28,16,2.0461492042850584,0.6276244918588072,222.0
凱聯大廈,台北市中山區吉林路379巷10號,64.2,40,14,0.4103011861963491,0.4881598423239879,1036.0
國賓精典,台北市中山區中山北路二段65巷1號,55.8,27,9,0.2044122219157275,0.6224827381291712,2142.0
理性.感性,台北市中山區基湖路116號,86.9,13,12,0.6941344581191543,0.2588406967921504,483.0
松江188,台北市中山區松江路188巷2號,116.2,7,11,0.5359797825510443,0.2165868790878632,2074.0
倫敦華廈,台北市中山區明水路397巷7弄40號,82.0,29,16,0.7018445930054118,0.1183740135029486,382.0
莎菲學院大廈,台北市中山區德惠街3巷1號,74.9,16,10,0.3824639859758436,0.064791967107772,988.0
首泰三悉-風昀,台北市中山區樂群二路86號,149.6,5,15,0.228517722920217,0.5166406933000313,444.0
忠泰美學,台北市中山區基湖路145巷28號,123.9,14,12,0.8219169064198281,0.357161194160317,470.0
南京之星,台北市中山區南京東路二段214巷8號,92.8,11,12,0.2517350312303943,0.3227701381863555,2223.0
菁品,台北市中山區林森北路107巷18號,48.2,23,11,1.1387837034228236,0.3773362495483883,2634.0
東坡居大廈,台北市中山區龍江路71巷17號,91.8,23,12,0.3213798368237996,0.0705872526873873,2196.0
中山拾美,台北市中山區農安街125巷36號,78.4,5,12,0.5348767026646455,0.1050886264085848,949.0
金財神大廈,台北市中山區林森北路259巷11號,57.2,38,8,0.9436389854783486,0.2895605236062277,2453.0
大直來富,台北市中山區北安路588巷30弄10號,64.8,28,17,0.658898796549834,0.2379148595746454,417.0
南京世紀大樓,台北市中山區建國北路二段3巷13弄2號,68.9,30,11,0.0659746032297218,0.2769362381229444,2173.0
麗晶小雅大廈,台北市中山區新生北路三段34號,64.6,28,12,0.1696697522954179,0.0904361148466883,1353.0
國賓桂冠,台北市中山區中山北路二段62巷8號,66.5,15,7,0.2456020114129818,0.5767371283898981,2156.0
大直米蘭,台北市中山區樂群三路67號,87.5,15,16,0.4955317154099958,0.5960254663285594,448.0
首泰三悉-磊若,台北市中山區樂群二路66號,150.2,5,15,0.3098058610400184,0.4358120100685669,442.0
松江TWIN PARTY,台北市中山區松江路37巷8號,86.9,17,9,0.6961666790391279,0.3622724381041233,2102.0
七喜大廈,台北市中山區中原街16號,67.4,42,10,0.6137839751799959,0.2151790976498385,2447.0
國賓 e life,台北市中山區中山北路二段62巷3號,67.6,15,7,0.2293974034014283,0.597320121037232,2152.0
漂亮e-spa,台北市中山區南京東路一段132巷30號,66.0,21,11,1.1339376697239287,0.2986440991829818,2632.0
環球財星大樓,台北市中山區林森北路623號,62.6,31,11,0.2561047983888825,0.2137335277005385,989.0
幸福五町目,台北市中山區林森北路85巷2號,59.5,12,7,1.072087459894731,0.4442302549419706,2554.0
松江smile,台北市中山區四平街105號,83.5,21,11,0.2945399815073554,0.1421831327329075,2206.0
大直觀邸,台北市中山區文湖街21巷16號,62.0,31,15,0.8766821571936615,0.0776371064639731,375.0
松江璀璨,台北市中山區松江路133巷50號,102.2,18,11,0.4168778846531046,0.0989559168152276,2157.0
麗池卡登,台北市中山區林森北路85巷31號,68.6,15,8,1.0767039174589086,0.373098904147164,2606.0
台北六本木,台北市中山區林森北路107巷65號,73.1,11,8,1.1189138762232085,0.2644676747646149,2508.0
櫻HOUSE,台北市中山區林森北路119巷18號,78.3,16,8,1.191303485366113,0.3327834984063135,2678.0
紐約四季大廈,台北市中山區林森北路655號,69.3,19,11,0.3451451248218963,0.2415898143582675,896.0
大直匯,台北市中山區敬業一路135號,97.6,7,16,0.7036098490811269,0.5390219630565047,426.0
東光富貴角,台北市中山區林森北路432號,62.8,26,9,0.3382460067498705,0.2281387599452179,1962.0
喜美雅築,台北市中山區林森北路85巷66弄1號,62.0,38,8,1.048296489031494,0.3113770835816297,2441.0
力行新城忠孝,台北市中山區通北街65巷2弄18號,54.4,24,16,1.946735271988632,0.709513625996035,187.0
國賓好漾,台北市中山區中山北路二段62巷9號,67.8,14,7,0.2289096187427337,0.5685653568594798,2140.0
南京富心,台北市中山區遼寧街101巷19號,90.7,8,13,0.5034514113184565,0.1457095819231088,2150.0
長野米蘭,台北市中山區北安路666號,124.0,3,16,0.8871811305806702,0.3050086301929461,379.0
明水漾,台北市中山區敬業三路161巷57號,119.1,19,14,0.2039316839365176,0.5371011577981762,430.0
生活樂多,台北市中山區中山北路二段59巷7號,84.6,7,11,0.3291382020253904,0.6184084018323954,2181.0
文華麗舍,台北市中山區南京東路三段89巷27弄10號,103.6,5,11,0.1878189970190654,0.3377619676666722,2207.0
京典,台北市中山區南京東路三段14巷8號,81.5,13,14,0.1144596640659333,0.2028689936018933,2170.0
鑑賞家大廈,台北市中山區中山北路一段53巷24號之1,68.0,22,6,0.9094926541314652,0.5335336281253465,2374.0
吉林華廈,台北市中山區吉林路176號,63.9,41,10,0.4941784926790252,0.280194810820282,2236.0
第凡內巴黎,台北市中山區中山北路一段135巷26號,60.9,11,7,1.1987794140008603,0.4859822162411144,2436.0
雅砌大廈,台北市中山區中山北路一段105巷21號,59.6,28,7,1.131655401698733,0.4870200076225077,2425.0
長春閣,台北市中山區合江街58巷20號,75.2,19,12,0.3870631298253654,0.1617437225266168,2208.0
統美E南京,台北市中山區長春路258巷26號,70.5,20,11,0.1703113221144045,0.3259092296934739,2226.0
南京三越大廈,台北市中山區中山北路一段126巷15號,75.1,24,5,1.0486673380172082,0.2799428090778954,2514.0
中山春大樓,台北市中山區撫順街41巷1號,59.9,34,10,0.394288709778111,0.1866728256627867,1458.0
榮御中山,台北市中山區龍江路2號,94.1,5,10,0.6139382839224549,0.2510595901832605,2289.0
逸廊,台北市中山區基湖路151巷21號,80.8,18,13,0.7692734384352852,0.3021490324385162,461.0
民生賓儷,台北市中山區中原街46號,96.2,4,9,0.5103456595687419,0.3299640863425482,2382.0
忠泰Vogue,台北市中山區北安路458巷47弄18號,84.3,15,15,2.523259010856652,0.2424301958314618,309.0
五常大廈,台北市中山區五常街3號,63.6,12,14,0.6895565609563313,0.4517351303138566,837.0
迪雅大樓,台北市中山區林森北路107巷35號,57.4,34,11,1.1314841121513943,0.3285437508859097,2652.0
阿曼風雅華廈,台北市中山區民生東路一段70巷6號,70.9,15,9,0.4260424262068166,0.4492073205801526,2417.0
冠堤晶華B區,台北市中山區民生東路一段70巷11號,70.8,15,10,0.4499989532183793,0.4184448967631251,2445.0
敦北金賞,台北市中山區龍江路288號,82.7,23,15,0.783592597447446,0.3512908577453871,1247.0
明珠精典,台北市中山區松江路204巷23號,69.4,8,11,0.4327405311637929,0.312073667193334,2013.0
村上瓏,台北市中山區新生北路三段87巷9號,71.3,2,14,0.5277770852913872,0.4634068593170772,875.0
麗仕,台北市中山區撫順街2號,60.5,27,8,0.3487251473448233,0.2916786074573428,1412.0
蘇富比逸園,台北市中山區中山北路一段83巷13號,70.7,38,6,1.07119000606417,0.5150461102074781,2428.0
景泰園,台北市中山區基湖路157巷8號,130.9,20,12,0.7372037548399965,0.2516512955532556,427.0
松江DEAR,台北市中山區長安東路二段7號,70.3,16,8,0.8668825495493441,0.1336899622452521,2107.0
龍安翡翠大廈,台北市中山區農安街25號,70.4,25,10,0.1344080094633549,0.2232893320699163,1277.0
峰華苑,台北市中山區中山北路二段115巷30號,80.0,12,9,0.3074616399583514,0.1973098318423684,1807.0
華泰苑,台北市中山區長安東路一段56巷1弄37號,75.0,4,9,0.963797700277564,0.3256713467658649,2017.0
太平洋閣廈Ｂ區,台北市中山區北安路630巷25弄10號,96.6,25,18,0.7819524184480713,0.3927305464606322,403.0
隨意鳥,台北市中山區中山北路二段85巷1號,90.8,3,7,0.1132814142563339,0.4513903395183478,2023.0
絕代風華大樓,台北市中山區雙城街4巷2號,64.8,28,11,0.1336506322004929,0.2332927613821637,1482.0
旭邦中山麗緻,台北市中山區民權東路一段58巷7號,68.0,7,12,0.1627060488574675,0.1661729029633487,1619.0
松江無籬,台北市中山區松江路170巷11號,115.1,5,10,0.5905331718294237,0.2375759341821998,2137.0
太子美麗殿,台北市中山區敬業一路1號,75.4,18,15,0.406067148614939,0.3781595422830556,442.0
金年華廈,台北市中山區德惠街170巷1號,54.9,40,13,0.5338518346768998,0.609267138686306,915.0
民生傑座,台北市中山區民生東路二段147巷12弄1號,62.5,23,12,0.3500475318935238,0.4862849973545539,1791.0
明水硯大樓,台北市中山區樂群二路30巷38弄36號,41.6,14,14,0.2349622762493268,0.5284534897388139,411.0
親親大樓,台北市中山區中山北路一段105巷4號,55.6,45,8,1.0851411837834248,0.4235962325916274,2471.0
星勢力大樓,台北市中山區明水路598號,85.2,21,17,0.5290139804655904,0.3743533811198124,424.0
青山通,台北市中山區松江路63巷1號,88.0,4,10,0.5774407576622133,0.2595324890329262,2119.0
龍江福邸,台北市中山區五常街91號,71.4,37,16,1.0324797267165298,0.0487588076348861,751.0
大直比漾,台北市中山區北安路669號,78.8,5,18,0.9741266479998848,0.3135554415051237,373.0
首璽一品花園,台北市中山區基湖路120巷1號,95.8,21,13,0.6729530013686095,0.2301126363764387,477.0
華威國賓,台北市中山區中山北路二段72巷9號,76.5,15,8,0.1896402265215944,0.5804383396183235,2130.0
漂亮寶貝,台北市中山區中山北路一段83巷20號,51.6,26,7,1.0382087498320756,0.5405028679923407,2444.0
達麗花園,台北市中山區明水路526巷50號,137.7,19,14,0.3438884202249244,0.4012993999768277,424.0
松江VIVI,台北市中山區松江路204巷26號,93.1,7,11,0.4534743169695095,0.3083782215864241,2033.0
松江樂活大樓,台北市中山區松江路184巷26弄10號,86.3,14,10,0.5461203413578846,0.2343377789178838,2200.0
金谷大厦,台北市中山區農安街41號,60.1,46,11,0.0591322352418504,0.1526446930647653,1287.0
凱旋大樓,台北市中山區民權東路406號,57.8,36,17,0.6581264312839151,0.1865812416262202,296.0
狀元第小登科,台北市中山區明水路397巷7弄44號,95.5,30,16,0.6862247523717209,0.1152430912875005,387.0
中山靜盧,台北市中山區錦州街4巷7號,69.1,25,10,0.1462575359135696,0.3877741290797927,1979.0
麗芙花園大廈,台北市中山區遼寧街101巷21號,91.0,17,14,0.5168964251566049,0.1699277977894547,2117.0
伊通街21號華廈,台北市中山區伊通街21號,67.6,8,10,0.4826254122442747,0.2674511712299617,2193.0
資生大樓,台北市中山區南京東路一段120號,72.1,26,9,1.137874813806817,0.1993938783230344,2577.0
達麗,台北市中山區長安東路一段65巷16號,79.2,8,8,1.0500891853006071,0.2857956653743889,2385.0
小雅投資大廈,台北市中山區安東街19號,73.9,41,9,0.5904904424755661,0.0610006458052634,1751.0
琴韻家,台北市中山區樂群三路63號,83.2,16,16,0.5195915470064518,0.5927910465703059,443.0
森美館,台北市中山區林森北路649號,75.8,15,13,0.3229389212358611,0.2269667551225836,917.0
菁棧,台北市中山區敬業一路128巷41號,88.2,15,16,0.5434634436172232,0.6597241481168964,447.0
忠泰CHIC,台北市中山區敬業一路185號,105.4,15,16,0.592584371571078,0.659035121521815,439.0
松江花園B棟,台北市中山區建國北路二段226巷41號,28.3,22,12,0.4457107298816549,0.5636592900018289,1563.0
伊通苑鼎苑,台北市中山區伊通街1號,84.3,5,9,0.5701302486200783,0.2690038440011561,2193.0
大直花園,台北市中山區通北街111號,71.9,22,16,1.8848528942305176,0.8073864637128981,162.0
大直艾菲爾大廈,台北市中山區敬業一路128巷10號,78.0,19,16,0.5780064529087207,0.5873126413396993,439.0
六條華廈,台北市中山區中山北路一段105巷18號之1,54.0,39,7,1.1186707337928574,0.468330438590928,2455.0
南京東錄大廈,台北市中山區長春路258巷6號,77.7,26,12,0.2228661688652088,0.3222417378195229,2225.0
躍松江大樓,台北市中山區松江路64巷22號,83.6,6,10,0.7996520587877662,0.1101560151129592,2118.0
京華園,台北市中山區龍江路114巷1號,72.6,38,11,0.2355949007044081,0.2927515199704214,2164.0
中山藏豐,台北市中山區中山北路二段72巷17號,80.2,10,8,0.2047839158195841,0.5338183058463705,2132.0
金橙吉錦,台北市中山區吉林路258號,85.0,8,10,0.2089938497116191,0.4270520087748087,1908.0
民生金碧園,台北市中山區合江街100巷1號,69.1,37,13,0.6862258804143315,0.1517395815510556,2031.0
吉田,台北市中山區新生北路二段101巷21號,72.2,19,11,0.5022218738220677,0.3112073218008903,2354.0
富貴臻品,台北市中山區遼寧街101巷25號,79.4,17,14,0.5307237017492445,0.1877082071638226,2071.0
大直峰閣,台北市中山區敬業一路36巷1號,83.3,15,16,0.3942186561352808,0.4803220937808022,454.0
老爺中山名廈,台北市中山區中山北路二段27巷11號,78.2,25,8,1.1856162439403863,0.5201659852253704,2368.0
三境伊登,台北市中山區伊通街19巷30號,70.7,8,10,0.4489467270842672,0.184816817368732,2248.0
錦州華廈,台北市中山區錦州街106號,56.4,39,11,0.3797725605380112,0.263736316080839,1997.0
大直玉璽,台北市中山區北安路588巷13號,77.5,25,17,0.7445163663545112,0.2707122206277871,412.0
大直翠堤,台北市中山區大直街62巷5弄14號,84.1,20,18,1.3094677150923977,0.0851865429407047,295.0
大直璞園,台北市中山區基湖路112巷56號,94.6,19,14,0.559380751259712,0.1719517878303059,467.0
城市島嶼,台北市中山區民生東路一段70巷15號,63.4,28,9,0.4528186047471624,0.4115719650960772,2441.0
阿曼風尚,台北市中山區民生東路一段70巷10號,81.1,15,10,0.433650177154468,0.4307559904500811,2430.0
中租和信家,台北市中山區德惠街65號,66.2,21,10,0.3407248996725679,0.3872504198834732,977.0
墨香明水,台北市中山區明水路666號,118.1,12,16,0.7206521047489103,0.4828356586773369,405.0
安家京漾,台北市中山區林森北路145巷52號,70.9,11,8,1.149860720027477,0.2217122552359592,2631.0
水名錄,台北市中山區明水路650號,75.7,15,17,0.6985640361368215,0.4879546430683006,407.0
富貴天廈,台北市中山區樂群三路51號,90.6,17,16,0.5512016719231324,0.5439972855173213,440.0
