陽明藏,台北市北投區長壽路15號,56.0,14,30,0.458484866242316,0.2443199062911601,258.0
青島大廈,台北市北投區行義路154巷19弄2號,37.6,42,28,1.4977227025195934,1.040327147600594,86.0
天母御園,台北市北投區榮華一路16號,58.1,21,23,0.4818340812860855,0.1581568409026557,1003.0
宏盛得意山莊-微風區,台北市北投區三合街一段117巷53號,72.8,5,25,1.5462843990501625,0.3515755415072205,375.0
捷運Life,台北市北投區北投路一段59號,53.9,10,24,1.7707860902605752,0.5743646552268248,375.0
天母紳堡,台北市北投區石牌路一段168號,21.2,18,22,0.0473589534897374,0.1522241148966682,438.0
奇妍會館,台北市北投區清江路91巷11號,51.1,8,26,1.084620517339716,0.2705227010034297,487.0
假日休閒,台北市北投區光明路240號之1,38.8,40,32,0.4260404804867266,0.2074978923448042,350.0
青庭大樓,台北市北投區致遠一路一段11巷1號,18.4,19,22,0.8126509144143789,0.205422020964087,638.0
四季虹,台北市北投區西安街一段187號,52.9,11,22,0.6111314736362069,0.2707209573175606,665.0
天母原墅,台北市北投區行義路130巷8號,62.2,14,29,1.3304659790810676,1.050911911221051,108.0
築立方,台北市北投區西安街一段231號,77.5,11,22,0.5071994359347883,0.3737676634734297,620.0
宏盛得意山莊-春風區,台北市北投區三合街一段117巷52號,73.2,5,25,1.5286291315905325,0.3712874785535256,366.0
石牌典藏,台北市北投區石牌路一段166巷31弄8號之1,61.0,13,23,0.0672879716077454,0.2422124872833716,411.0
天御,台北市北投區溫泉路73巷8號,35.5,13,30,0.3479731885413737,0.2047981072639836,462.0
天母SOHO,台北市北投區行義路10巷7號,72.3,5,26,0.7978628952594026,0.4504214045737147,389.0
亞麗璞石,台北市北投區自強街61巷19號,54.0,13,22,0.3645768890536198,0.4574819908107727,341.0
北歐客廳B區,台北市北投區知行路214巷13號,53.3,11,26,0.218501958123886,0.1150196156190897,150.0
名人居,台北市北投區石牌路一段166巷43弄22號,58.5,9,24,0.1205088730404223,0.2333437615315786,418.0
大家風範大樓,台北市北投區吉利街106巷3號,56.5,27,24,0.8958236374051658,0.1976732847391013,272.0
磺溪椰林,台北市北投區天母西路117巷61號,58.9,24,26,0.1943759922835654,0.347259717103746,484.0
松漢掬雲,台北市北投區三合街一段82巷109號,72.0,6,27,1.2274149663859542,0.4109832135763066,466.0
囍市,台北市北投區中央北路一段155號,45.3,27,26,0.5549408235233043,0.0780049485332792,495.0
陽明麗緻,台北市北投區一德街50號,44.9,10,28,0.4380401220481852,0.1543317488365202,168.0
綠波廊二期,台北市北投區民族街17號,59.0,9,28,0.8830398271484752,0.2037914205491509,519.0
和風小鎮,台北市北投區大業路629巷22號,49.2,14,26,0.4564222802336303,0.1289591473116937,483.0
御泉,台北市北投區溫泉路74號,42.9,15,31,0.2742245584412046,0.0628284338762624,505.0
喆園,台北市北投區中和街493巷11弄35號,34.7,14,30,0.6681333722157561,0.6094339294657767,215.0
得意大廈,台北市北投區行義路186巷24號,31.5,37,30,1.6418984657207367,0.9915953279747464,67.0
達觀賞,台北市北投區大度路三段301巷25號,50.0,15,26,0.2264453047354785,0.2995554288635668,164.0
天母麗景,台北市北投區行義路130巷11號,37.5,25,29,1.365413815769052,1.0826403732784198,102.0
天母磺溪,台北市北投區天母西路122號之1,64.2,13,24,0.2568319639209577,0.1658632902900663,592.0
中國花園第一大廈,台北市北投區榮華二路1號,55.1,43,22,0.34419326684998,0.2236740187647193,935.0
鄉林大境C區天嵐區,台北市北投區行義路170巷27弄11號,58.6,10,29,1.5924258713112105,1.0018659358102555,72.0
陽明書院明德會館,台北市北投區明德路290號,86.6,7,23,0.1069172311407045,0.2334154679314583,833.0
北投福岡,台北市北投區溫泉路87號,40.8,24,32,0.5602182475825033,0.2012516187602061,466.0
崇仰21,台北市北投區崇仰一路21號,60.8,10,27,1.0563806189579497,0.4499932814751803,162.0
中國花園第三大廈,台北市北投區榮華三路3號,53.3,41,22,0.2952341975440065,0.1844721031740922,923.0
雲崗捷運森活館,台北市北投區中央北路二段383號,48.1,15,28,1.428376265729751,0.311848326678725,80.0
奇岩花園,台北市北投區公館路255巷19弄7號,54.3,12,26,1.1507494394800597,0.2378027342976888,305.0
崗山社區,台北市北投區崗山路24號,32.7,31,30,1.4220989921927494,0.3193254682906726,89.0
加賀屋,台北市北投區新興路153號,53.0,16,28,1.4433494095879371,0.2676899137390768,80.0
曼哈頓大樓AB棟,台北市北投區明德路203號,76.0,43,22,0.4612983816922628,0.042863594463362,890.0
曼哈頓大樓F棟,台北市北投區建民路161號,76.3,46,23,0.6251093130269337,0.2346468668101162,813.0
基泰雙璽,台北市北投區立農街二段202巷3弄11號,67.2,23,25,0.4008490290615659,0.1269736724771434,391.0
永成大樓,台北市北投區立功街135號,31.6,15,25,0.3033125518382857,0.5621356988046482,156.0
御和風,台北市北投區中央南路一段183號,51.9,23,25,1.1960039409553818,0.2722232682074273,467.0
懷玉,台北市北投區石牌路一段166巷43弄14號,59.8,14,24,0.1200210502531164,0.2644763932004718,406.0
北投新月台大樓,台北市北投區中正街49巷33號,63.7,25,26,0.166905785756461,0.0508023530421518,492.0
天母唯美,台北市北投區懷德街90號之2,64.2,28,23,0.3488413315251497,0.274915054035902,709.0
新光仰翠華廈,台北市北投區石牌路二段335號,59.0,27,26,0.4919400471157197,0.438935577260499,449.0
奇岩理想家,台北市北投區崇仁路一段118號,58.9,24,24,1.687082908918882,0.6129136270704412,368.0
北投天下大觀Ｃ棟,台北市北投區復興二路60巷4號,39.6,28,30,0.5632625814953595,0.1834834006916814,218.0
天母築藝,台北市北投區石牌路二段315巷28弄16號,73.5,14,27,0.4566772741537075,0.5926978483835134,427.0
關渡豪景,台北市北投區大度路三段301巷52號,28.3,25,26,0.1512563221317827,0.249526672313253,164.0
奇岩鮮境,台北市北投區清江路177巷35號,56.0,17,25,1.2839916183766662,0.4372152411594699,459.0
關渡海岸,台北市北投區知行路275號,54.2,17,26,0.141904053843937,0.1643306348677684,159.0
昇陽麗芙大廈,台北市北投區同德街26號,56.6,18,27,0.972215410410363,0.5784275417065289,351.0
天母晶品,台北市北投區尊賢街239巷7號,65.7,14,23,0.703378051446158,0.4475039743535862,323.0
甲桂林山莊E區,台北市北投區中山北路七段219巷3弄15號,53.1,38,28,1.1909863413279047,0.7888967553034046,308.0
薇閣美地,台北市北投區珠海路60巷8號,41.6,19,30,0.3217109382674649,0.0681192781481233,343.0
璞真崇仰大廈,台北市北投區天母西路117巷48號,74.2,10,25,0.1201841773487637,0.319027783407099,494.0
首席天富,台北市北投區西安街二段333號,58.8,9,26,1.0852829009628222,0.1472354847145716,315.0
瀞香,台北市北投區溫泉路58巷2弄1號,45.3,13,29,0.7248498622365585,0.0605697674166257,539.0
馥苑大樓,台北市北投區石牌路二段90巷36號,53.6,18,25,0.2585427428745725,0.2196065134860655,614.0
捷運經貿都星大樓,台北市北投區大興街67號,30.4,29,25,0.9998199836583443,0.1088641457109406,507.0
別墅傳奇,台北市北投區長壽路27號,30.7,29,30,0.4177958670689844,0.1405000447116051,267.0
天母樺園大廈,台北市北投區明德路257號,33.5,42,24,0.2135620819637213,0.142313980713126,860.0
天母國家花園別墅群,台北市北投區明德路150巷30號,50.8,41,21,0.6951317428420412,0.2202462844776554,936.0
陽明華府,台北市北投區新民路13號,44.0,12,29,0.291950882472475,0.1264529635934588,324.0
懷石,台北市北投區大業路637號,47.5,26,26,0.3836857468913104,0.2046888279164158,478.0
和園,台北市北投區西安街二段171號,66.6,12,25,0.6325262462000004,0.2478205551935027,369.0
春揚薇閣,台北市北投區珠海路109巷18號,55.9,25,31,0.3832137844706609,0.1741155730969581,289.0
綠波廊,台北市北投區民族街15號,50.5,15,28,0.8970517397796636,0.2328824389539051,523.0
雅典,台北市北投區明德路337巷19號,56.3,20,24,0.2747829102002808,0.1586145560984966,635.0
文苑,台北市北投區翠宜路9巷10號,34.6,28,31,0.4781939123614552,0.2213301604316819,239.0
閤冠富御,台北市北投區東華街二段300巷23號,64.2,11,24,1.113165407922373,0.2694103519051088,316.0
麗園大廈,台北市北投區懷德街3號之9,56.1,38,22,0.6954780248638043,0.2780513641864373,810.0
鄉林大境A區,台北市北投區中山北路七段219巷3弄251號,74.9,10,28,1.6291653417063163,0.9328615497573371,86.0
青茵樂,台北市北投區崗山路18號,53.0,14,30,1.450427985082895,0.3045601397670601,85.0
安家星賞,台北市北投區吉利街127巷5號,68.8,14,24,0.8962818697198931,0.1842826405680578,316.0
虹橋大廈,台北市北投區泉源路30號,34.2,45,30,0.315933892113484,0.1703147624338608,311.0
天母新錢站,台北市北投區西安街一段367號,64.1,26,23,0.126055585200406,0.1991023623731101,427.0
天母逸品,台北市北投區同德街20號,65.2,11,27,0.9243189089656167,0.5606496383680128,366.0
天母十六行館,台北市北投區行義路124巷11號,52.5,14,28,1.396152701734164,1.0702944258537417,103.0
皇宮綠園,台北市北投區稻香路185號,28.8,44,30,1.3396174213959084,0.578617620485301,87.0
三穎麗緻,台北市北投區民族街11巷12號,60.5,16,28,0.9087253591464398,0.2533678588726886,522.0
榮華公園華廈,台北市北投區裕民一路40巷39號,43.8,40,26,0.4065061200819267,0.3965936066309552,553.0
拾渼,台北市北投區石牌路二段343巷10號,60.8,12,26,0.3984436659236348,0.5149862691221836,455.0
悠美,台北市北投區中央北路三段118巷13號,44.2,10,30,1.846571224381582,0.2457146485351518,62.0
天母和風,台北市北投區致遠一路二段112巷23號,64.2,22,23,0.0452788621549923,0.2076313798307048,400.0
廣陽世家向榮區,台北市北投區中和街錫安巷26號,47.5,23,29,0.6734994575229506,0.3992740436293329,180.0
花墅大廈,台北市北投區翠宜路31號,29.0,27,32,0.5581880007396861,0.2912158596648077,226.0
中國名門大廈,台北市北投區明德路號,47.1,38,22,0.5888883851743747,0.1499980456124596,907.0
三穎珮荷蕾特,台北市北投區東華街二段66號,59.9,14,25,0.3284664797300101,0.1520139407426779,427.0
關渡逸品,台北市北投區知行路256號,61.3,15,26,0.128876209694524,0.1098384880225327,158.0
拓樸,台北市北投區富貴一路1巷6號,69.2,15,23,0.1991516382102374,0.1834852391957813,893.0
蒲陽玉品,台北市北投區建民路112號,70.6,18,23,0.66083617862176,0.2027990649407332,632.0
雲崗高爾夫休閒館,台北市北投區稻香路161巷1號,37.2,15,29,1.2561588554209362,0.5360732562724618,103.0
聚旺之居,台北市北投區清江路68號,50.3,14,26,1.029230515895873,0.1921217290615349,499.0
天母WINNER,台北市北投區石牌路二段315巷10弄7號,73.3,15,26,0.1811929086185653,0.4869707578833155,446.0
陽明心秀,台北市北投區中和街493巷3號之1,40.9,16,30,0.832547377081045,0.7164430726575397,174.0
綠樹春和,台北市北投區立農街一段277號,58.0,14,23,0.9962884704041076,0.0959866388827324,302.0
欣暘綠築A區,台北市北投區中央北路三段40巷34弄17號,47.6,12,30,1.5730912909563128,0.1143262278730316,72.0
東坡居大廈,台北市北投區新民路1巷6號,31.6,36,30,0.2660298479876808,0.1973035911170358,246.0
天母新宿,台北市北投區立農街二段270號,58.6,27,25,0.3057142960289751,0.1589720644563903,396.0
玫瑰詩篇,台北市北投區石牌路二段315巷6號,42.0,25,26,0.313197660717593,0.4364372024348371,493.0
天母禮居大廈,台北市北投區榮華三路15號,51.3,22,23,0.248464641248406,0.1187121618648407,899.0
青木淳,台北市北投區致遠一路一段78號,77.2,9,23,0.5828133474305628,0.3625458146778757,536.0
奇里快,台北市北投區西安街二段265號,89.4,13,26,0.9504973092120532,0.2425881425346214,347.0
天美,台北市北投區大屯路18號,46.8,10,29,0.367769268446499,0.1912416860490786,287.0
大業極美,台北市北投區大業路300巷9弄16號,64.1,14,25,1.2427399360081073,0.2875949743672132,411.0
沂水園大廈,台北市北投區溫泉路73巷13號,49.9,23,31,0.2459823547547875,0.0890375136733194,496.0
亨利百世二期,台北市北投區大興街60號,46.9,28,25,1.027668389541838,0.0941529493637117,499.0
倚翠溫泉花園,台北市北投區泉源路39號之26,35.1,41,30,0.2260477306668546,0.1134273542903793,213.0
石牌贊大樓,台北市北投區石牌路一段166巷46號,81.7,14,23,0.0555796699570719,0.2495812486864725,406.0
龍邸大廈,台北市北投區義方街28號,54.0,24,29,0.1778711412256187,0.1437880799533676,363.0
明德非凡大廈,台北市北投區明德路96號,77.9,21,22,0.7873134790538214,0.1937740931536787,845.0
天母花都A棟,台北市北投區石牌路一段39巷36弄11號,53.8,28,23,0.3370205046986189,0.1263949983312306,359.0
珠海灣大廈,台北市北投區珠海路119號,44.2,14,30,0.4743098837312279,0.3174405702244039,230.0
天母芳鄰大廈,台北市北投區自強街5巷143號,64.9,21,22,0.3616237089943016,0.2966456581051412,353.0
戀戀北投一期,台北市北投區清江路177巷20號,59.5,21,26,1.2965310672982924,0.4391924303112404,453.0
亞洲天母別墅,台北市北投區行義路124巷2號,29.2,41,29,1.2938312770852072,1.0146553914730294,119.0
宏得金陛,台北市北投區珠海路113巷16號,47.8,12,31,0.4287309927929025,0.2038421971624586,271.0
薇閣華廈,台北市北投區復興一路58號,34.4,16,30,0.3231160401398649,0.1171143833966933,311.0
良緣大樓,台北市北投區立農街一段306號,66.2,26,23,0.9709023964860226,0.1139047906564868,302.0
翰林華廈,台北市北投區裕民六路120號,58.3,26,24,0.3838421726932491,0.4385059760314503,543.0
天母花都Ｂ棟,台北市北投區實踐街82巷1號,80.9,28,23,0.3188133946558538,0.0971110831167706,363.0
天母大亨大廈,台北市北投區石牌路二段348巷20號,51.4,28,26,0.48126815906903,0.3762454899964788,482.0
天母翠庭,台北市北投區石牌路二段343巷7號,66.2,20,27,0.5091703909069614,0.4935230626917834,424.0
三豐傑園,台北市北投區裕民六路110號,54.2,25,25,0.3681098233832016,0.436425389769188,525.0
薇閣大廈,台北市北投區中央北路一段180巷5號,37.9,28,26,0.5077124674468438,0.1530715281554886,482.0
松原,台北市北投區西安街二段345號,56.9,18,26,1.13030992192922,0.1398296753881034,306.0
四方之寓大樓,台北市北投區裕民六路114巷45號,76.4,9,24,0.4160992545791054,0.3545707065881991,675.0
環翠園名宮大廈,台北市北投區溫泉路73巷5號,29.2,33,31,0.2787172376344076,0.1461850080328888,483.0
大吉大利,台北市北投區吉利街123巷12號,76.5,26,24,0.9279055649153533,0.1512027294080027,304.0
精工大樓,台北市北投區自強街83號,57.1,47,22,0.3716138638259995,0.5365965794348554,411.0
天母綠光大廈,台北市北投區榮華一路2巷15號,73.3,15,23,0.3638827823384301,0.128424318938703,956.0
天母世家大廈,台北市北投區石牌路二段330巷2號,57.5,33,26,0.1793070645312792,0.3728898602295105,491.0
建富雙橡園,台北市北投區石牌路一段39巷80弄27號,73.8,20,23,0.3928818898577422,0.1698428981254207,373.0
緣中園,台北市北投區吉利街177號,57.2,23,24,0.7611048956692403,0.346511187610714,340.0
非凡比大樓,台北市北投區北投路一段73號,55.0,27,24,1.2769586684962646,0.3128137922311749,428.0
關渡台北雅居華廈,台北市北投區知行路262號,39.3,22,26,0.1439229185898446,0.1424829915026724,158.0
陽明璞園,台北市北投區復興三路61巷6號,34.3,23,30,0.6839451392540259,0.2389712732758474,165.0
天天天母大廈,台北市北投區石牌路二段343巷24號,64.2,24,26,0.3821786094327847,0.5106414274518495,459.0
珠海長春小築,台北市北投區珠海路126號,34.9,41,30,0.4131848865024902,0.2541883737693406,226.0
隱逸,台北市北投區復興一路55號,48.4,11,30,0.28498253706748,0.1086843200768538,322.0
翠嶺花園大廈,台北市北投區翠嶺路9號,50.5,16,31,0.5089141500010513,0.3326085222842733,223.0
一品大觀,台北市北投區自強街120巷15弄7號,78.2,15,24,0.4757568701518397,0.3883637283975174,575.0
天母青靚大廈,台北市北投區富貴一路5巷7號,73.0,15,23,0.159244946141346,0.2246233964799664,882.0
天生貴族,台北市北投區義理街63巷4弄13號之1,35.7,32,26,0.3647439117701446,0.2101433262224878,410.0
金滿圓,台北市北投區翠宜路57號,44.5,16,31,0.5174044823984457,0.207328832370222,230.0
天頌,台北市北投區行義路10巷9弄16號,67.6,16,27,0.8681743686869178,0.529487020596911,371.0
義貴新村甲區,台北市北投區致遠二路125巷11號,74.6,26,25,0.408164084757228,0.2255559082230065,391.0
全陽雅筑大廈,台北市北投區東華街一段6號,67.6,18,21,0.9663418252531084,0.1879040223443056,830.0
捷運桃源大廈,台北市北投區中央北路三段40巷38弄18號,42.0,20,30,1.5795244205353434,0.1132754112679754,73.0
天生麗質,台北市北投區新民路17號,47.7,23,29,0.3058099124618589,0.1368089253687135,324.0
天母新城A座,台北市北投區天母西路117巷52弄15號,55.3,38,26,0.1795077051779911,0.2705723818935029,485.0
新洋房櫻花泉,台北市北投區長壽路29巷11號,47.4,11,31,0.3850392195438297,0.1307557283886641,281.0
花墅,台北市北投區翠宜路46號,32.0,27,32,0.5511352189486745,0.2136113384183938,225.0
廣大小雅Ｂ棟,台北市北投區致遠一路二段45巷7號,65.3,22,24,0.2750714466438475,0.402030778819847,363.0
皇家別府,台北市北投區行義路140巷10號,36.9,38,29,1.3645013526691534,1.1279382274106402,95.0
溫莎小品,台北市北投區石牌路二段315巷27號,48.3,26,27,0.15802022451207,0.5372738012181172,422.0
陽明書院石牌會館,台北市北投區石牌路二段325巷10號,60.4,10,26,0.3918884237777801,0.4968639582535573,469.0
建築經典大樓,台北市北投區自強街26號,63.3,20,22,0.4466963627031453,0.5046347803022354,324.0
富貴大樓,台北市北投區富貴一路1號,65.9,40,23,0.2790266675163885,0.1577093834966835,917.0
亨利百世,台北市北投區大興街55號,55.2,28,25,0.2357136130985676,0.0696101605586689,500.0
信義W會館,台北市南港區成福路194巷8號,75.9,9,8,0.6629904255294164,0.274137690485191,508.0
中研苑AB棟,台北市南港區研究院路二段2巷12弄5號,44.6,14,8,3.442924358515326,0.4261953476413831,386.0
南港龍華,台北市南港區同德路85巷2號,68.9,38,6,0.0626741345059947,0.1576430014163918,746.0
香朵,台北市南港區松河街762號,67.0,13,6,2.217024507230918,0.4274440365821679,535.0
東方爵士大廈,台北市南港區成福路178巷2號,49.2,27,8,0.5540681219577993,0.3259479593831089,577.0
忠孝龍華,台北市南港區同德路85巷12號,65.6,38,5,0.075372034152279,0.1583012405725711,747.0
湯泉一號,台北市南港區研究院路三段7號,53.4,12,10,4.678311927360624,0.5095340826216744,135.0
芬第LIFE,台北市南港區向陽路258巷100號,13.1,14,5,1.5063051977204631,0.579071174914884,217.0
雅曼尼CASA,台北市南港區重陽路125巷26號,80.1,16,6,1.6540983182663829,0.4776549667142917,304.0
晶鑽凱悅二期,台北市南港區重陽路125巷36弄30號,64.6,15,7,1.5869591623390555,0.4510538656163588,271.0
住安中研,台北市南港區舊莊街一段265號,53.7,5,11,4.931058551999613,0.5006644588708894,109.0
中研新村C區,台北市南港區研究院路二段70巷37弄10號,42.7,39,9,2.784293908903193,0.5352846122579888,245.0
世貿旺角,台北市南港區興東街7號,82.0,27,4,2.708273830901162,0.2963909015314181,490.0
忠孝東路六段華廈,台北市南港區忠孝東路六段9巷2號,57.3,38,5,0.3668086220600576,0.3556772655497565,828.0
東方文華,台北市南港區興華路66號,99.8,18,2,2.217352266960896,0.1655506929662487,365.0
慾望城市西城區,台北市南港區向陽路258巷25號,79.7,15,6,1.479215056457073,0.5252058911328565,223.0
廣哲,台北市南港區向陽路162巷103號,84.0,9,6,1.6064554921307368,0.4561288517456779,302.0
鉑金苑,台北市南港區經貿二路235巷20號,96.1,8,6,2.4994268758249945,0.5790363667422631,492.0
南港逸品,台北市南港區南港路二段282號,67.0,2,3,1.342187106577037,0.1880740108563222,270.0
天開圖畫,台北市南港區東新街170巷41號,85.8,8,9,0.8036829967008381,0.4509464595737369,276.0
忠孝名宮,台北市南港區中南街142號,71.3,25,5,3.16313533855538,0.436647689230759,462.0
河岸慕上,台北市南港區松河街398號,44.2,8,5,0.9903717704234268,0.5434911973310848,279.0
松漢雍容,台北市南港區重陽路125巷36弄16號,80.9,9,6,1.6255379279279791,0.5052587799930379,283.0
龍華新城,台北市南港區忠孝東路六段142號,73.3,30,6,0.1800917227317234,0.1733665497024905,713.0
風雅,台北市南港區經貿二路157巷36弄88號,81.1,14,7,2.476265131955261,0.6105038357005359,502.0
研究硯,台北市南港區研究院路二段12巷57弄2號之1,60.0,7,8,2.784289718158835,0.5207336138964987,379.0
筑夢easy,台北市南港區舊莊街一段267號,46.7,4,11,4.9366737981911655,0.5054637365140094,107.0
登富世家大廈,台北市南港區南深路15號,49.7,12,10,4.695344430878609,0.2477574162417238,135.0
誠美謙謙,台北市南港區成福路51號之1,133.6,6,7,0.3035394755546994,0.152096209660118,676.0
晶鑽凱悅一期,台北市南港區重陽路125巷36弄12號,70.3,15,6,1.628703896317278,0.4929141564775574,279.0
經貿BOSS,台北市南港區重陽路487號,52.8,14,5,2.25334827528255,0.3582790747983871,533.0
華麗圓舞曲,台北市南港區重陽路61號,82.6,11,5,1.5124598406914902,0.356393994284423,296.0
都泊林A區,台北市南港區東新街180巷1號,58.2,22,5,0.7525021385387463,0.4105382618513121,262.0
法國春天大廈,台北市南港區中坡北路60巷28號,71.4,25,4,0.4473557746874749,0.3232358746531619,826.0
花悅四季,台北市南港區重陽路57巷61號,60.6,16,6,1.5686197182145605,0.4870749777572919,227.0
璞園向陽,台北市南港區向陽路196巷21號,68.7,11,6,1.4142651092746237,0.3603910674258181,218.0
經貿Party,台北市南港區重陽路551號,83.1,15,6,2.336464642286284,0.5011662172536908,493.0
俬房綠,台北市南港區福山街5號,55.6,7,8,3.720948486455389,0.3597506736649345,254.0
京石隱,台北市南港區經貿二路157巷36弄76號,76.8,9,6,2.5164552806791534,0.5970149892994877,488.0
向陽傑作大廈,台北市南港區向陽路196巷30號,78.6,14,6,1.4772936216189625,0.3682984654695999,214.0
如陽Living,台北市南港區重陽路125巷36弄46號,68.9,12,6,1.554244318939616,0.4337033129203689,230.0
南港遠東ABC智慧科學園區,台北市南港區南港路三段48號,37.0,33,6,1.0626934656990832,0.2918690394254357,241.0
國泰忠孝華廈,台北市南港區玉成街140巷11弄2號,68.3,41,6,0.3966103258271692,0.2012806717878719,857.0
世貿橘園大廈,台北市南港區重陽路57巷51號,76.8,16,6,1.5807860371591804,0.460238260174975,232.0
三陽忠孝明園,台北市南港區中坡南路3號,77.3,34,5,0.4781528790472891,0.205687987395462,882.0
御創中研,台北市南港區研究院路二段12巷19號,50.6,14,7,3.478201902130448,0.4167865144595755,371.0
忠孝名邸,台北市南港區忠孝東路六段178號,51.4,22,6,0.2065181833335964,0.1514847156600292,645.0
松石苑,台北市南港區研究院路二段12巷30號,44.2,13,7,3.481978642816861,0.4471131960009767,360.0
陽光水岸大廈,台北市南港區向陽路258巷106號,52.4,12,5,1.5404372379065416,0.5713084263468676,244.0
蘋果廣場,台北市南港區中坡北路92號,82.7,26,3,0.564717859245787,0.1755734325665136,780.0
上哲,台北市南港區研究院路二段12巷5號,55.0,15,7,3.513968230688416,0.3968273980486189,359.0
卡地雅,台北市南港區重陽路39巷47號,66.5,15,6,1.4391675262251753,0.3416777758149075,211.0
慾望城市蘇活區大廈,台北市南港區重陽路57巷88號,63.8,15,6,1.446423229484685,0.577882893432044,191.0
一品中研,台北市南港區舊莊街一段3巷12弄1號,49.8,15,9,4.179004276656347,0.0784506085958529,188.0
巴黎富邑大廈,台北市南港區向陽路258巷67號,78.5,15,6,1.476371913595257,0.5425311704654256,202.0
左岸庭苑,台北市南港區重陽路376號,81.0,18,4,2.220357495992838,0.1312661670112779,479.0
東方水美,台北市南港區興南街60巷1號,62.0,12,4,1.9971298830181183,0.1254696919841365,285.0
左岸巴黎,台北市南港區重陽路503號,77.2,17,6,2.2742176339396925,0.480069449738474,541.0
YES新世貿,台北市南港區經貿一路57號,79.7,13,6,3.0629234800865364,0.5340851699682833,307.0
世紀廣場特區,台北市南港區重陽路218號,51.6,16,4,1.8806160765421087,0.2005731269583136,289.0
慾望城市上東區,台北市南港區重陽路57巷33號,60.4,15,6,1.5373389768850787,0.4033411742765349,253.0
樂鑽,台北市南港區成福路204號,88.0,17,8,0.7044311909680517,0.2965344793073737,451.0
胡適風華,台北市南港區舊莊街一段3巷24號,44.5,17,9,4.159810165313254,0.0670851965680982,188.0
成德公教住宅,台北市南港區東新街63巷1號,53.9,23,5,0.1174335584238056,0.0813185655805985,690.0
中研新村B區,台北市南港區研究院路二段70巷47弄36號,55.0,39,8,2.664921545171196,0.6531796090008464,287.0
六邑欣象,台北市南港區重陽路125巷16號,55.8,16,5,1.6352246371262478,0.423169632076073,313.0
華園,台北市南港區重陽路57巷46號,58.3,16,6,1.5203554976728162,0.3968441351531517,231.0
大智雲集,台北市南港區向陽路162巷28號,74.9,19,6,1.3535946410299762,0.2329766297230509,214.0
王基靜園,台北市南港區研究院路一段49號,74.1,13,4,3.168038127673679,0.2506472806054568,407.0
園墅,台北市南港區港東街98號,82.7,16,6,3.339463164881109,0.3902035754081848,287.0
極緻DECO,台北市南港區東明街108巷12號,47.9,16,4,1.7054109669238635,0.243617534511045,323.0
富邦東新名廈,台北市南港區東新街64巷11號,48.2,34,5,0.0916645435486891,0.1485465593112652,767.0
成功富邑大樓,台北市南港區向陽路162巷1號,59.4,15,6,1.322472535555702,0.2407158133505943,219.0
