家賀屋大廈,台北市北投區清江路25巷7號,33.9,21,27,0.9069082560816972,0.2499873554372547,516.0
樂揚,台北市北投區大業路 368號,63.4,21,24,0.2313398052277663,0.3069937636790949,396.0
杏林文化,台北市北投區杏林三路11號,44.3,9,28,0.3272235118584822,0.422082404919532,370.0
天璽大廈,台北市北投區裕民二路33巷2號,83.0,16,25,0.3369744619716438,0.3534903866541242,459.0
北歐客廳C區,台北市北投區知行路230號,57.2,11,26,0.1077440474667934,0.0802119640385816,156.0
天母森琉璃,台北市北投區石牌路二段315巷23號,52.1,13,26,0.0946311836834974,0.4941916413099164,426.0
鈺璽若白,台北市北投區明德路267巷10號,79.7,10,24,0.1798594947401547,0.1967265024249233,832.0
吉峻觀邸,台北市北投區關渡路12號,46.1,15,25,0.3659723878855638,0.3311142310144768,161.0
陽明賞,台北市北投區西安街二段275巷5號,66.6,17,25,0.9690075806481684,0.2067681194018653,323.0
陽明山下大廈,台北市北投區北投路二段17號,58.2,32,25,0.0027669242686605,0.1844015508117634,475.0
天母創世紀大廈,台北市北投區石牌路二段97巷1號,42.9,31,25,0.2927356050580709,0.2873504840259943,440.0
天母悅章,台北市北投區承德路七段342號之1,84.3,13,23,1.0335385051160733,0.242475704049925,219.0
上階綠,台北市北投區榮華一路20巷20號,62.2,10,23,0.3989686561680573,0.1221196865190109,991.0
關渡之美,台北市北投區關渡路10號,48.9,16,25,0.3775364709694416,0.3469261723514396,161.0
英倫大廈,台北市北投區自強街126號,68.4,13,23,0.4104649799561675,0.4593181100953381,501.0
陽明天母大廈,台北市北投區立農街二段202巷10號,47.4,41,24,0.4369050431675974,0.1334737668087772,397.0
吾居吾宿,台北市北投區豐年路一段52號,67.2,12,26,0.6927556143746707,0.1659275873984521,515.0
遠東瑞市蘇黎世區大廈,台北市北投區文林北路214號,42.1,27,22,0.6850273756292499,0.2272995445803884,429.0
遠雄明德,台北市北投區文林北路130號,73.1,16,21,0.9502449634251672,0.2108309609071158,611.0
天母雲集大廈,台北市北投區石牌路二段359號,71.6,21,26,0.6813946823570782,0.4816188826824462,393.0
昇陽麗晶大廈,台北市北投區行義路12號,81.8,18,27,0.7940398644724045,0.5351615594215533,371.0
北歐風格大樓,台北市北投區北投路一段83號,64.7,13,25,1.220668876326092,0.2560000865101289,448.0
薇閣名廈,台北市北投區中央北路一段10號,17.7,25,27,0.6472846886110406,0.0986244113014409,538.0
松石雲台大廈,台北市北投區同德街10號,55.5,30,26,0.8855116734554701,0.5604909640842839,367.0
天母名門,台北市北投區立農街二段206號,78.6,26,25,0.4054344383288937,0.0846204427991941,389.0
天母森活大廈,台北市北投區行義路130巷21號,40.1,26,29,1.421925910228837,1.0912994064255237,94.0
天母皇裔大廈,台北市北投區承德路七段212號,61.5,15,22,0.7065381623882533,0.4935280796226654,303.0
台北御園大廈,台北市北投區關渡路36號,50.5,19,25,0.2997344428187832,0.2375673176403213,157.0
天母富邦大樓,台北市北投區天母西路136號,80.2,20,24,0.1946532045037247,0.1274722103569474,563.0
奇岩傑仕堡二期,台北市北投區公館路165號,46.6,26,27,1.2089420178652954,0.2616035960691019,450.0
上景大廈,台北市北投區承德路七段282號,38.8,16,23,0.86408733937767,0.3630361466687308,256.0
采風名門大廈,台北市北投區中央北路一段168號,28.8,22,26,0.5353862732086233,0.1060756918170213,490.0
加賀VILLA,台北市北投區光明路168號,70.3,13,28,0.2533687954986574,0.1659816990614775,526.0
國寶花園,台北市北投區雙全街20號,60.1,16,28,0.1007428025255171,0.1806318107086895,463.0
山景大廈,台北市北投區大業路508號,52.3,20,25,0.8943696507346693,0.0550110099145486,483.0
天母明珠華廈,台北市北投區石牌路二段357巷11號,54.5,26,27,0.6627726713801476,0.5588799892862488,388.0
力霸雅宴,台北市北投區大業路533號,46.8,27,25,0.6956413301537164,0.2106894552836517,473.0
上北澤,台北市北投區天母西路117巷12號,77.1,15,24,0.1149951910356383,0.3130846128847231,546.0
雅雷特,台北市北投區石牌路二段357巷3號,69.9,13,26,0.5901996294764829,0.5073761562756871,398.0
攬翠大廈,台北市北投區石牌路二段357巷7號,70.7,14,27,0.6197242634159168,0.5400439211432378,393.0
天母富桂,台北市北投區行義路16號,73.3,10,26,0.8173373361279505,0.5449848381372076,364.0
寒舍雅筑大廈,台北市北投區文林北路250號,58.1,38,21,0.5628979066121456,0.3709171855356654,371.0
北投天下大觀Ａ棟,台北市北投區復興三路68號,32.5,28,30,0.6628947190780397,0.2523674679356045,186.0
萊茵尊品大廈,台北市北投區知行路316巷1號,49.8,26,26,0.2618107218783559,0.3052229195640257,165.0
家居春緣,台北市北投區行義路5巷7號,61.8,13,26,0.7181345352206988,0.5068285732488251,389.0
首席天廈,台北市北投區天母西路117巷26號,29.0,31,24,0.0686940846683817,0.339847805327812,518.0
溫莎康橋花園,台北市北投區行義路15號,50.2,20,26,0.7799957179057564,0.5592564451219607,369.0
北投天下大觀Ｂ棟,台北市北投區復興二路60巷1號,41.7,28,30,0.6155445357030479,0.2339919494209237,208.0
花園富裔,台北市北投區東陽街411巷29號,70.2,23,24,0.4922410715025742,0.3374131687547618,600.0
石間,台北市北投區大業路298號,58.1,22,25,1.344151779714208,0.3907005852612101,377.0
樹之海大廈,台北市北投區東華街二段294號,58.8,28,24,0.986064870304621,0.292303563648742,346.0
文林風華大廈,台北市北投區文林北路300號,56.5,27,21,0.4497324885045713,0.4995906671019615,319.0
圓山園大廈,台北市北投區文林北路276號,58.0,24,22,0.5267908186720871,0.4243179755805564,341.0
承德首席大廈,台北市北投區承德路七段310號,57.0,21,23,0.961134246157134,0.2772306856570439,228.0
廣大公園大廈,台北市北投區清江路25巷16號,51.6,22,27,0.9275687606601868,0.2576237399902938,514.0
薇閣世家,台北市北投區中央北路一段號,59.4,28,27,0.5730433859340527,0.0567402303062414,528.0
陽明苑,台北市北投區珠海路133巷10號,42.6,15,31,0.3315539143236558,0.1132445760933312,204.0
甲桂林山莊D區,台北市北投區中山北路七段219巷3弄189號,54.8,38,28,1.491667416260042,1.0025440952667402,94.0
漢唐天廈,台北市北投區光明路167號,44.8,31,28,0.2268052667645103,0.1939312597414451,512.0
澄品,台北市北投區致遠一路一段104巷2號,67.5,15,23,0.5043226631225579,0.4257154285716149,478.0
臨溪山莊大樓,台北市北投區同德街23巷1號,49.4,29,27,1.0674811076316653,0.6582927142732952,341.0
同欣天廈,台北市北投區中央北路一段125號,60.2,27,26,0.5665252936282216,0.0174220218361282,521.0
南港國宅,台北市南港區福德街373巷35號,53.2,24,10,0.996590153690762,0.5047619991866591,238.0
森之丘,台北市南港區東新街122號,76.8,13,7,0.2385093571171055,0.161745992299845,517.0
四季LULUR,台北市南港區忠孝東路六段132號,112.1,12,6,0.1774501844610563,0.1742978412411786,719.0
謙御,台北市南港區重陽路547號,62.1,11,6,2.315927735870197,0.4944856583301588,498.0
萬象廣場綜合大樓,台北市南港區八德路四段869號,62.0,27,1,0.7582255299041885,0.138559617297157,668.0
名豐時藝,台北市南港區經貿二路231號,78.8,8,6,2.542067049093585,0.5525835869709111,472.0
忠孝無極,台北市南港區忠孝東路六段100號,90.7,8,4,0.1865371522018983,0.2473885920650347,754.0
納美,台北市南港區東新街118巷29號,84.3,11,8,0.2546149629289627,0.1239105657773549,513.0
翔譽之心,台北市南港區興中路28巷10號,83.2,10,3,2.310222128314248,0.1044598736331938,432.0
巴黎春天,台北市南港區南深路31號,31.9,23,10,4.762618648824718,0.3001451000504728,134.0
聯勤四季紅,台北市南港區園區街36號,98.6,12,6,2.4110815567192474,0.2408536607406135,473.0
都泊林C區,台北市南港區東新街180巷11號,66.3,20,7,0.8125059158871744,0.4412226565457025,229.0
日升月恆,台北市南港區經貿二路235巷23號,109.6,8,7,2.613234624879416,0.6600501879615971,469.0
東煒富寓,台北市南港區研究院路二段151號,51.5,9,10,4.487692923011974,0.3044629885141909,158.0
華固天匯,台北市南港區經貿二路157巷48號,91.0,10,7,2.776375557525363,0.7523778643680424,425.0
双美舘,台北市南港區興中路56巷3號,84.2,5,3,2.204482003720849,0.0538542210543149,396.0
東方大地,台北市南港區南港路二段20巷5號,71.5,33,1,2.144988439814857,0.2652627185213176,359.0
正隆晶鑽,台北市南港區三重路41巷20號,86.6,9,5,2.393979587061154,0.2940213508683471,473.0
長虹菁英,台北市南港區經貿二路157巷36弄56號,92.1,9,7,2.591790655593801,0.6043028768831774,458.0
翡翠山林,台北市南港區中坡南路49巷1號,72.3,27,6,0.4437658704588718,0.066266139840582,824.0
東方晶典,台北市南港區經貿二路235巷53號,84.6,13,7,2.540158756882016,0.6913732889279866,491.0
中研新苑大樓,台北市南港區研究院路二段98巷21弄1號,54.8,9,8,3.729846957304981,0.3779595119145692,227.0
元利世紀匯,台北市南港區重陽路458號,98.4,13,6,2.258563401803472,0.1822939556441483,490.0
NY21紐約花園,台北市南港區三重路41巷33號,70.1,11,5,2.3932362915751537,0.3366817023282948,510.0
泰御,台北市南港區經貿二路235巷50號,61.3,10,7,2.502059122525345,0.6282565153052657,495.0
經貿爵士,台北市南港區經貿二路157巷36弄101號,85.7,9,7,2.477233774967775,0.6366394955974147,493.0
高過岸,台北市南港區重陽路483號,75.4,8,5,2.238839207967334,0.3272372206124587,507.0
凌雲五村,台北市南港區研究院路三段10巷1號,53.0,19,11,4.55635248564449,0.5539171701812127,141.0
大同明日世界世界館,台北市南港區經貿二路157巷36弄109號,73.6,12,7,2.433734292801492,0.6095000913317208,497.0
信義之丘,台北市南港區福德街326號,61.8,10,9,0.7985816147181118,0.1899962309929641,467.0
大同璽苑,台北市南港區經貿二路157巷36弄100號,80.1,9,6,2.3838333917765806,0.5846394135405744,505.0
風尚,台北市南港區重陽路588號,80.4,16,6,2.406151067217523,0.5633634108266942,491.0
冠德中研,台北市南港區研究院路二段61巷15號,68.6,9,8,3.893145781923787,0.2308274588697486,228.0
東方晶采,台北市南港區經貿二路245號,89.3,10,6,2.4593719015679585,0.5231067250707132,497.0
映東騰,台北市南港區昆陽街177號,81.1,6,5,0.7960582820717489,0.4441728268686037,250.0
寶時捷,台北市南港區興中路56巷11號,70.6,28,3,2.1859008557504414,0.0853116849063951,375.0
台北悅桂冠,台北市南港區園區街15號,80.4,16,6,2.3074901293586496,0.1434708720185146,494.0
水岸雙星,台北市南港區經園街64號,80.5,15,7,2.5936038938474315,0.743185720833085,485.0
皇鼎花園廣場,台北市南港區向陽路162巷56號,72.0,12,6,1.4357731626386605,0.2955722246662039,238.0
首泰大方,台北市南港區重陽路478號,70.9,7,5,2.287191830219818,0.2842973275662609,494.0
東方晶璽大樓,台北市南港區經園街58號,70.4,11,8,2.560049778651388,0.7091465855635796,480.0
Chloe,台北市南港區南港路三段320號,76.6,4,2,0.7618254751527945,0.2300637589064685,596.0
華固文匯,台北市南港區研究院路二段98巷21弄10號,52.0,12,9,3.796538401899728,0.3211463628759033,208.0
Twin Park,台北市南港區經貿二路255巷58號,72.5,3,7,2.4396361754207123,0.605404226576557,491.0
力麒村上爵士,台北市南港區東明街26號,81.5,14,3,2.1131067055571098,0.2413709569045991,329.0
松河麗景,台北市南港區松河街290號,93.0,15,4,0.8387380716595385,0.1660533117104339,586.0
皇鼎花園別墅,台北市南港區向陽路162巷21號,61.8,15,6,1.3615682618700684,0.2589620550361183,215.0
東京一會館,台北市南港區向陽路162巷100號,65.2,12,6,1.602416011751855,0.4466317734737513,315.0
溫歌華花園,台北市南港區向陽路258巷1號,81.2,16,5,1.4444237366364718,0.5213722220005584,228.0
遠見名門大廈,台北市南港區重陽路316號,70.5,22,3,2.0349987017626705,0.2208463019032462,350.0
大哲悅,台北市南港區研究院路一段101巷16弄10號,80.0,10,6,3.2982508318493617,0.3582639992839607,398.0
風華,台北市南港區園區街58巷1號,62.4,14,5,2.359927588460914,0.2083915291956459,477.0
甲子園,台北市南港區園區街22號,95.6,12,6,2.4630074407414435,0.2943086547215325,454.0
中研帝寶別墅,台北市南港區研究院路二段90號,47.7,10,9,3.816993770879953,0.287791512837513,221.0
重陽花園新城,台北市南港區松河街550號,53.6,18,5,1.6376561492864368,0.3843321016547257,276.0
東京雙星,台北市南港區東新街108巷4弄1號,102.5,11,8,0.1431852142028695,0.1211200021610237,651.0
晴之初大廈,台北市南港區興中路60號,72.2,16,3,2.2067774039850443,0.0488653375018518,406.0
互助名門,台北市南港區中坡北路553巷9號,76.4,22,3,0.0386923146172666,0.1037132822443707,765.0
東方晶鑽,台北市南港區松河街756號,69.5,7,5,2.210777700177153,0.3461063255964421,520.0
信義邸,台北市南港區成福路149巷5弄1號,67.4,9,9,0.5631310027009548,0.3500016619050839,452.0
遠雄國際金融廣場,台北市南港區忠孝東路六段21號,79.6,18,5,0.3537971513193194,0.3980112673215435,800.0
苑景,台北市南港區興南街150號,54.6,10,4,1.5782679234026875,0.3572428830019181,330.0
互助典藏,台北市南港區同德路34號,98.4,15,5,0.2330284148393222,0.2990128380702626,782.0
玉河苑,台北市南港區八德路四段923號,52.9,9,2,0.6912389272979056,0.2866032050012845,610.0
大同明日世界明日館,台北市南港區經貿二路255巷1號,89.3,12,6,2.4262719365309406,0.5511507930891167,512.0
南港臻愛,台北市南港區南港路三段215號,79.2,17,2,0.7698970942397425,0.1749106526349914,632.0
威京尊龍二期,台北市南港區南港路二段142號,81.6,28,2,1.6752503870287256,0.2971005349816829,321.0
力麒村上自由區,台北市南港區興華路64巷1號,75.8,14,2,2.1721641061627515,0.2106385737489381,352.0
力麒村上青春區,台北市南港區東明街51號,101.2,14,3,2.08097583275779,0.2069720413393644,315.0
謙閤,台北市南港區研究院路二段88號,51.0,9,9,3.7875244369180927,0.315922886047516,227.0
華固奧之松,台北市南港區重陽路125巷36弄11號,71.7,13,6,1.5835843517462342,0.5311046608057978,265.0
三鐵首馥大廈,台北市南港區興華路140號,67.7,14,3,2.046017267994712,0.2227047984818163,351.0
華固富仕館,台北市南港區向陽路196巷8號,85.8,14,6,1.3483046655178623,0.3121632419959318,223.0
潤泰東方麗池,台北市南港區經貿二路157巷64號,75.3,14,7,2.701987532889733,0.7421423225214577,424.0
東方晶華,台北市南港區經貿二路235巷58號,68.2,14,7,2.479634965468001,0.6503325484015192,494.0
彩色羅馬,台北市南港區東明街108巷1號,77.1,13,4,1.738936427583483,0.2167510064764663,326.0
亞瑪森花園,台北市南港區向陽路162巷101號,75.8,18,6,1.6073639629318923,0.4588670072082008,293.0
威京尊龍一期,台北市南港區南港路二段178巷26號,75.4,29,3,1.6753398903194918,0.258243125236145,319.0
台北之翼大廈,台北市南港區重陽路39巷86號,89.8,19,6,1.4300920601863905,0.3937930065871466,220.0
力麒村上藍調區,台北市南港區南港路二段38巷24號,99.2,14,1,2.123264563249404,0.2888969361039445,348.0
優客里鄰,台北市南港區成福路175號,73.3,27,8,0.6580832653317319,0.3317346453019067,447.0
東方君悅大廈,台北市南港區興華路73號,80.2,17,2,2.227143568607698,0.1723332525362473,374.0
經貿地飆大樓,台北市南港區經貿二路157巷36弄93號,75.3,17,7,2.49151882550334,0.6401462604518922,497.0
第一道大廈,台北市南港區園區街8號,92.0,13,5,2.534972877540279,0.3553411895502856,439.0
昇之陽花園大廈,台北市南港區興華路117號,59.5,25,3,2.1141246278187844,0.1581547437184724,358.0
太陽大帝,台北市南港區研究院路一段99號,75.9,24,5,3.226086502631357,0.3122928034608914,404.0
松廈柏園,台北市南港區松河街494號,50.3,17,6,1.4257201858674835,0.5867165752214616,192.0
漱夏行館,台北市南港區松河街480號,55.4,14,6,1.4296295659644846,0.5762499704577687,203.0
海華上品居,台北市南港區忠孝東路五段799號,70.0,38,5,0.4771367383103308,0.2654047382912891,887.0
興陽大廈,台北市南港區興南街32號,59.1,22,4,1.967305377058262,0.2155373550985239,310.0
忠孝璞園,台北市南港區研究院路二段2巷12弄10號,41.6,25,8,3.427968531829184,0.4562897757818979,387.0
益明大樓,台北市南港區忠孝東路五段815號,88.0,35,5,0.4353243503327799,0.2980681199116726,871.0
威京尊龍三期,台北市南港區南港路二段146號,87.4,26,2,1.6563815517782412,0.2982759261430538,319.0
宏盛我城,台北市南港區經貿二路185巷50號,80.4,12,7,2.645135191616523,0.7453968403219693,467.0
和楓大賞,台北市南港區重陽路187巷6號,61.1,20,5,1.682904449752804,0.3928003860049542,316.0
福田名廈,台北市南港區南港路一段8號,52.7,16,5,3.3157462459604226,0.140282521034685,329.0
東京花園,台北市南港區重陽路57巷2號,65.8,17,6,1.444998484734901,0.293824582098754,267.0
力麒村上搖滾區,台北市南港區南港路二段38巷37號,88.2,14,3,2.151840201562565,0.2360470432178245,340.0
花都中國,台北市南港區興南街64巷6弄11號,69.6,29,5,1.8373436909302825,0.0892160751666152,312.0
潤泰東方麗邑,台北市南港區經貿二路157巷36弄90號,69.9,14,7,2.454668702990199,0.6025938428646994,504.0
豐福天廈,台北市南港區忠孝東路六段2號,81.8,17,5,0.3259644055071217,0.2952436376692766,827.0
馥麗大廈,台北市南港區中坡南路37號,94.9,17,6,0.4631038975744732,0.0570937741405085,843.0
蒂芬尼GARDEN,台北市南港區重陽路125巷1號,63.3,15,5,1.6469309710049258,0.4128557937663309,314.0
三希棠,台北市南港區東明街111號,59.6,12,3,1.7056741716748736,0.2218758895507796,321.0
觀之林大廈,台北市南港區舊莊街二段1巷10號,37.0,28,11,4.90775730866291,0.4964268959327935,105.0
福樂家大廈,台北市南港區興中路12巷23號,64.1,27,2,2.269718997090896,0.1516122197762008,401.0
御林園大廈,台北市南港區東新街113巷1號,56.5,24,7,0.4030667544717085,0.1620529776764651,401.0
東方晶御,台北市南港區重陽路號,67.0,10,3,1.950041591144352,0.290342973742473,337.0
至善天下,台北市士林區至善路二段150號,81.5,26,21,3.2388806622580737,0.3803929778789233,82.0
天母懷德,台北市士林區忠誠路一段171巷12弄1號,88.4,13,22,0.1292910561841805,0.1772072832109484,727.0
新光仰仁名廈,台北市士林區忠誠路二段48號,82.8,35,21,0.6071989786016468,0.1418925646381663,758.0
川普至善Villa,台北市士林區至善路二段90號,75.6,7,19,2.82464054236334,0.4229807815197255,86.0
黃金藝術賞,台北市士林區克強路15巷5號,91.5,20,21,0.8095171496666694,0.1345249711034934,934.0
隱士林,台北市士林區士商路149號,89.0,16,17,0.3267047128181307,0.1597994663455781,1018.0
知鈺,台北市士林區芝玉路二段86號,83.7,2,24,0.8456753366049116,0.2316355197766698,516.0
士林官隱,台北市士林區福林路251巷8號,95.7,8,18,0.7875540981537711,0.1782803222830856,344.0
太子天母,台北市士林區芝玉路一段196號,75.7,27,23,0.3510089564161572,0.3505684095614119,561.0
天母紘琚,台北市士林區中山北路七段81巷28弄6號,115.3,11,26,1.010424149509601,0.3974914750391733,432.0
天星花園,台北市士林區中正路715號,54.4,19,16,1.4243735462277711,0.213501414495397,194.0
圓山1號院,台北市士林區基河路15號,69.1,7,15,0.5057667202836149,0.1578460000632901,1311.0
天母蘭桂坊,台北市士林區天玉街38巷12號,88.0,26,25,0.803952453384358,0.223819465121467,517.0
陽明新城,台北市士林區忠誠路一段100巷15弄1號,93.4,34,19,0.3828760873181736,0.236121990488767,902.0
新光仰賢華廈,台北市士林區忠誠路二段1號,79.9,36,20,0.4376297648484938,0.2485879693886815,692.0
寶殿大廈,台北市士林區文林路一段767號,49.4,42,17,0.4739940444679398,0.1956071295994925,1334.0
宏盛北美館,台北市士林區基河路30號,92.7,23,13,0.7222977829549478,0.3947244466267786,978.0
士科京璽,台北市士林區重慶北路四段222號,67.4,6,16,0.9128261926148288,0.5042461665848333,351.0
士林御花園大廈,台北市士林區忠誠路一段27號,74.6,34,20,0.4754349679177691,0.3164013749436488,1031.0
圓山巴黎,台北市士林區後港街160號,61.1,25,15,0.1727037033933978,0.2118162441288215,1259.0
環翠名宮,台北市士林區天母東路38號,65.2,36,25,0.9966752327528992,0.2900586071058199,561.0
官峰大樓,台北市士林區福志路116號,96.9,9,18,0.8074470729240597,0.2113943979974542,1113.0
奧之細道,台北市士林區天玉街58號,95.7,20,25,0.9756103964723964,0.3931555433043994,458.0
天母鬱金香大廈,台北市士林區忠誠路二段102號,75.4,36,22,0.8891733727940704,0.295663334392299,790.0
囍堂,台北市士林區文林路500號,85.7,10,19,0.1012983498236897,0.3716243651422002,1339.0
筑丰天母,台北市士林區中山北路六段35巷10號,105.3,6,18,0.7347539127544854,0.5331122364074895,1068.0
藏峰大廈,台北市士林區承德路四段85號,85.2,20,14,0.7247314990077295,0.3848265798035246,962.0
中正陽明花園,台北市士林區中正路426號,71.8,23,16,0.3690481596583305,0.2215162273849736,1253.0
國泰天母,台北市士林區中山北路七段87號,119.4,8,25,1.0454295509578155,0.4577847419333826,415.0
華固天鑄,台北市士林區天母東路8號,167.1,6,25,0.8727684635089598,0.3199656106058817,598.0
文林苑,台北市士林區文林路550號,87.4,7,19,0.0150282921403756,0.3370577222614428,1233.0
陽明松境,台北市士林區德行東路338巷25號,60.6,32,25,0.9041871651510632,0.3707307466644976,164.0
天母開發大廈,台北市士林區中山北路七段26號,51.6,37,25,0.876664477148267,0.3621272882168785,550.0
皇鼎麗園,台北市士林區德行東路331巷16號,76.5,17,24,0.8933514050941149,0.1245751386740837,310.0
圓山凡登大廈,台北市士林區承德路四段97號,93.8,14,14,0.6671240705256296,0.3590190205327176,984.0
國際名園,台北市士林區中山北路六段222號,92.6,19,20,0.7370813926459092,0.2349734960965025,926.0
天母星鑽大廈,台北市士林區中山北路七段81巷9號,89.5,30,25,0.9515224064411514,0.3592948264033355,452.0
臺北市圓山金城,台北市士林區承德路四段35號,71.4,26,14,0.9101343587014016,0.1202741478757188,776.0
云硯,台北市士林區士商路173號,107.8,3,17,0.3437164129246984,0.1060233670965855,938.0
圓山迎春風大廈,台北市士林區通河街17號,73.4,10,12,1.017955741148142,0.0528115326779366,641.0
縱橫天母,台北市士林區天玉街13號,82.3,16,25,0.664493974755161,0.0934627629217659,523.0
國家園首領袖區大樓,台北市士林區華齡街185巷1號,69.0,14,16,0.1504217410391926,0.1822154503200856,1181.0
躍天母,台北市士林區中山北路六段441巷28號,82.1,13,23,0.4027529912136291,0.1541888272923806,725.0
登峰造極,台北市士林區中庸一路11號之1,41.5,28,34,3.3665334845045742,0.5097533103462497,126.0
士林基河之星大廈,台北市士林區基河路100號,68.5,26,16,0.3722566329295533,0.1278387262203859,1376.0
遠雄天母,台北市士林區芝玉路一段222號,80.6,14,22,0.456329673178007,0.2825251782204658,565.0
天母國際大樓,台北市士林區天母西路3號,55.0,45,23,0.6876452127222841,0.1822256781477337,582.0
遠雄陽明,台北市士林區中山北路七段82巷12號,95.8,17,25,1.100532613486002,0.5478139250323566,435.0
德悅天映月,台北市士林區忠誠路一段131號,84.5,10,21,0.2404827941126898,0.1176467034950637,859.0
鄉林左岸,台北市士林區延平北路六段213號,58.0,6,17,1.4577544819461208,0.3136900184349466,199.0
圓山官邸,台北市士林區承德路四段195巷10號,88.3,14,15,0.2410896460764721,0.0837231709661044,1384.0
富麗圓山,台北市士林區承德路四段75號,68.6,22,13,0.8244446795781498,0.2447251935805512,884.0
忠誠大廈,台北市士林區中正路657號,38.0,49,15,1.290056832964267,0.2375184892617618,198.0
京水灩,台北市士林區環河北路三段203號,47.9,10,17,1.5885088637333735,0.3371079911042047,189.0
天母頂極,台北市士林區福華路158號,83.7,18,19,0.8655425968243486,0.42158578042439,895.0
陽明山泉,台北市士林區菁山路100號,41.7,23,36,3.9538190544845215,1.216934755406032,55.0
陽明松疆,台北市士林區基河路300巷21號,88.9,1,17,0.3408514563454933,0.214655361009425,1165.0
天母鉅星,台北市士林區忠誠路一段109號,67.9,33,20,0.2999946486116853,0.141273988510981,881.0
天母小西華,台北市士林區天母北路28巷39號,85.3,15,24,0.4298905599436636,0.194039534385129,581.0
金河帝國,台北市士林區延平北路六段356號,43.9,6,18,1.903568780163149,0.1537671119285473,151.0
圓山窗外大廈,台北市士林區基河路16號,134.8,18,13,0.8209345700276143,0.291359496983698,888.0
渼士林,台北市士林區中正路655巷6號,53.4,8,16,1.2936867291057357,0.1897858564805264,208.0
雨農山莊,台北市士林區雨農路62號,54.2,18,20,0.6153205278339067,0.339390360338878,585.0
天母自在,台北市士林區天母西路38巷5號,124.8,5,23,0.3841582735370554,0.2295662380988162,627.0
吉美悅河,台北市士林區重慶北路四段206號,53.1,9,15,0.9090641697468752,0.5051723029145048,356.0
樂河,台北市士林區延平北路六段386號,42.1,17,18,1.9588483868290696,0.2139603042066229,142.0
東騰天母,台北市士林區忠誠路二段21巷6號,109.3,12,23,0.4316563768401466,0.1902989481417624,648.0
澄品,台北市士林區延平北路五段69號,58.5,6,13,1.6859429995053392,0.5005906897662179,281.0
金河富居,台北市士林區環河北路三段205號,42.7,5,18,1.6043069077977166,0.3150239435847434,187.0
天母之御,台北市士林區芝玉路一段197巷11號,83.3,11,22,0.2351389785567441,0.3610359713803204,574.0
天母極品磺溪特區,台北市士林區福華路188號,81.8,23,21,1.0172643481606911,0.2644117741919363,804.0
